show_id,type,title,director,country,release_year,listed_in
s2104,Movie,Class of '83,Atul Sabharwal,India,2020,"Dramas, International Movies, Thrillers"
s2105,Movie,Dark Forces,Bernardo Arellano,Mexico,2020,"Horror Movies, Independent Movies, International Movies"
s2106,TV Show,Hoops,Unknown,United States,2020,TV Comedies
s2107,TV Show,Rust Valley Restorers,Unknown,Canada,2020,"International TV Shows, Reality TV"
s2108,Movie,The Sleepover,Trish Sie,United States,2020,"Action & Adventure, Children & Family Movies, Comedies"
s2109,TV Show,Goedam,Hong Won-ki,South Korea,2020,"International TV Shows, TV Horror, TV Mysteries"
s2110,Movie,John Was Trying to Contact Aliens,Unknown,United States,2020,"Documentaries, LGBTQ Movies"
s2111,Movie,Scarecrow,Khaled Marei,Egypt,2019,"Comedies, International Movies"
s2112,Movie,The Crimes That Bind,Sebastián Schindel,Argentina,2020,"Dramas, International Movies"
s2113,TV Show,DeMarcus Family Rules,Unknown,United States,2020,Reality TV
s2114,TV Show,High Score,Unknown,United States,2020,"Docuseries, Science & Nature TV"
s2115,Movie,Little Singham: Kaal Ka Badla,Prakash Satam,Unknown,2020,"Children & Family Movies, Comedies"
s2116,Movie,Drunk Parents,Fred Wolf,United States,2019,Comedies
s2117,Movie,Meet the In-Laws,Niyi Akinmolayan,Nigeria,2017,"Comedies, Dramas, International Movies"
s2118,Movie,Crazy Awesome Teachers,Sammaria Sari Simanjuntak,Indonesia,2020,"Comedies, Dramas, International Movies"
s2119,TV Show,Glitch Techs,Unknown,United States,2020,Kids' TV
s2120,Movie,Islands of Faith,Chairun Nissa,Indonesia,2018,"Documentaries, Faith & Spirituality, International Movies"
s2121,Movie,Les Misérables,Tom Hooper,"United Kingdom, United States",2012,"Dramas, International Movies, Music & Musicals"
s2122,Movie,Seventh Son,Sergei Bodrov,"United States, United Kingdom, Canada, China",2014,"Action & Adventure, Sci-Fi & Fantasy"
s2123,TV Show,Stranger,Unknown,South Korea,2020,"Crime TV Shows, International TV Shows, Korean TV Shows"
s2124,TV Show,Dérè: An African Tale,Unknown,Unknown,2016,"International TV Shows, Romantic TV Shows, TV Dramas"
s2125,TV Show,Rita,Unknown,Denmark,2020,"International TV Shows, TV Comedies, TV Dramas"
s2126,TV Show,Takki,Unknown,Saudi Arabia,2014,"International TV Shows, TV Dramas"
s2127,Movie,What's Your Raashee?,Ashutosh Gowariker,India,2009,"Comedies, International Movies, Music & Musicals"
s2128,TV Show,3%,Unknown,Brazil,2020,"International TV Shows, TV Dramas, TV Sci-Fi & Fantasy"
s2129,Movie,Beyond the Boundary: ICC Women's T20 World Cup Australia 2020,Anna Stone,Unknown,2020,"Documentaries, International Movies, Sports Movies"
s2130,Movie,Fearless,Cory Edwards,Canada,2020,"Children & Family Movies, Comedies"
s2131,Movie,Nigerian Prince,Faraday Okoro,"United States, Nigeria",2018,"Dramas, Independent Movies"
s2132,Movie,Octonauts & the Caves of Sac Actun,Blair Simmons,United Kingdom,2020,Children & Family Movies
s2133,Movie,Project Power,"Henry Joost, Ariel Schulman",United States,2020,Action & Adventure
s2134,TV Show,Teenage Bounty Hunters,Unknown,United States,2020,"Crime TV Shows, TV Comedies, TV Dramas"
s2135,TV Show,The Great Heist,Unknown,Colombia,2020,"Crime TV Shows, International TV Shows, Spanish-Language TV Shows"
s2136,TV Show,The Legend of Korra,Unknown,United States,2014,"Kids' TV, TV Action & Adventure, TV Sci-Fi & Fantasy"
s2137,TV Show,Zoids Wild,Unknown,Japan,2018,"Anime Series, Kids' TV"
s2138,Movie,An Easy Girl,Rebecca Zlotowski,France,2019,"Comedies, Dramas, International Movies"
s2139,Movie,Christine,Antonio Campos,"United Kingdom, United States",2016,"Dramas, Independent Movies"
s2140,Movie,Simon Killer,Antonio Campos,"United States, France",2012,"Dramas, Independent Movies, Thrillers"
s2141,TV Show,(Un)Well,Unknown,United States,2020,Reality TV
s2142,Movie,Gunjan Saxena: The Kargil Girl,Sharan Sharma,India,2020,"Action & Adventure, Dramas, International Movies"
s2143,Movie,Mr. Peabody & Sherman,Rob Minkoff,United States,2014,"Children & Family Movies, Comedies, Sci-Fi & Fantasy"
s2144,Movie,"Rob Schneider: Asian Momma, Mexican Kids",Tyler Spindel,United States,2020,Stand-Up Comedy
s2145,TV Show,GAME ON: A Comedy Crossover Event,Unknown,United States,2020,"Kids' TV, TV Comedies"
s2146,TV Show,Terrace House: Tokyo 2019-2020,Unknown,Japan,2019,"International TV Shows, Reality TV"
s2147,Movie,The Lost Husband,Vicky Wight,United States,2020,"Dramas, Romantic Movies"
s2148,Movie,Diamonds in the Sky,Kunle Afolayan,Unknown,2018,"Dramas, International Movies"
s2149,TV Show,The Governor,Unknown,Nigeria,2016,"International TV Shows, TV Dramas"
s2150,Movie,We Summon the Darkness,Marc Meyers,"United States, Canada, United Kingdom",2020,"Horror Movies, Thrillers"
s2151,Movie,"Berlin, Berlin: Lolle on the Run",Franziska Meyer Price,Germany,2020,"Comedies, International Movies"
s2152,TV Show,High Seas,Unknown,Spain,2020,"Crime TV Shows, International TV Shows, Spanish-Language TV Shows"
s2153,TV Show,Selling Sunset,Unknown,Unknown,2020,Reality TV
s2154,TV Show,Sing On! Germany,Unknown,Germany,2020,"International TV Shows, Reality TV"
s2155,Movie,Stars in the Sky: A Hunting Story,Steven Rinella,United States,2018,Documentaries
s2156,Movie,The Magic School Bus Rides Again Kids In Space,Richard Weston,United States,2020,Children & Family Movies
s2157,TV Show,Tiny Creatures,Unknown,United States,2020,"Docuseries, Science & Nature TV, TV Action & Adventure"
s2158,TV Show,Wizards: Tales of Arcadia,Unknown,United States,2020,"Kids' TV, TV Action & Adventure, TV Sci-Fi & Fantasy"
s2159,TV Show,Word Party Songs,Unknown,United States,2020,Kids' TV
s2160,Movie,Work It,Laura Terruso,United States,2020,Comedies
s2161,TV Show,Ever After High,Unknown,Canada,2016,Kids' TV
s2162,Movie,Nasha Natasha,Martín Sastre,Uruguay,2020,"Documentaries, International Movies, Music & Musicals"
s2163,TV Show,The Rain,Unknown,"Denmark, United States",2020,"International TV Shows, TV Dramas, TV Mysteries"
s2164,Movie,Anelka: Misunderstood,Franck Nataf,France,2020,"Documentaries, International Movies, Sports Movies"
s2165,Movie,Sin City,Pascal Amanfo,Unknown,2019,"International Movies, Thrillers"
s2166,TV Show,World's Most Wanted,Unknown,United States,2020,"Crime TV Shows, Docuseries, International TV Shows"
s2167,Movie,A Go! Go! Cory Carson Summer Camp,"Stanley Moore, Alex Woo",Unknown,2020,Children & Family Movies
s2168,Movie,Malibu Rescue: The Next Wave,Savage Steve Holland,United States,2020,"Children & Family Movies, Comedies"
s2169,TV Show,Mystery Lab,Unknown,Brazil,2020,"Docuseries, International TV Shows, Science & Nature TV"
s2170,Movie,Sam Jay: 3 In The Morning,Kristian Mercado,United States,2020,Stand-Up Comedy
s2171,TV Show,Immigration Nation,Unknown,United States,2020,Docuseries
s2172,Movie,Almost Love,Mike Doyle,United States,2020,"Comedies, Dramas, Independent Movies"
s2173,Movie,Killing Hasselhoff,Darren Grant,United States,2017,Comedies
s2174,TV Show,Moesha,Unknown,United States,2000,"TV Comedies, Teen TV Shows"
s2175,TV Show,My Perfect Landing,Unknown,Canada,2020,Kids' TV
s2176,TV Show,Nagi-Asu: A Lull in the Sea,Unknown,Japan,2014,"Anime Series, Romantic TV Shows, Teen TV Shows"
s2177,Movie,Rogue Warfare: The Hunt,Mike Gunther,United States,2020,Action & Adventure
s2178,Movie,Super Monsters: The New Class,Steve Ball,Canada,2020,Children & Family Movies
s2179,TV Show,The Next Step,Unknown,Canada,2018,"Kids' TV, Reality TV, TV Dramas"
s2180,Movie,The Ottoman Lieutenant,Joseph Ruben,"Turkey, United States",2017,"Dramas, Romantic Movies"
s2181,TV Show,Toradora!,Unknown,Japan,2008,"Anime Series, International TV Shows, Romantic TV Shows"
s2182,TV Show,Transformers Rescue Bots Academy,Unknown,United States,2020,Kids' TV
s2183,Movie,Tumi or not Tumi,Mfanelo Ngoma,Unknown,2020,Stand-Up Comedy
s2184,Movie,What Keeps You Alive,Colin Minihan,Canada,2018,"LGBTQ Movies, Thrillers"
s2185,TV Show,Get Even,Unknown,United Kingdom,2020,"British TV Shows, Crime TV Shows, International TV Shows"
s2186,Movie,Latte and the Magic Waterstone,"Regina Welker, Nina Wels",Germany,2020,"Children & Family Movies, Comedies"
s2187,Movie,Raat Akeli Hai,Honey Trehan,India,2020,"Dramas, International Movies, Thrillers"
s2188,Movie,Seriously Single,"Katleho Ramaphakela, Rethabile Ramaphakela",South Africa,2020,"Comedies, International Movies, Romantic Movies"
s2189,Movie,Sugar High,Ariel Boles,United States,2020,Children & Family Movies
s2190,TV Show,Sugar Rush,Unknown,United States,2020,Reality TV
s2191,TV Show,The Umbrella Academy,Unknown,"United States, Canada",2020,"TV Action & Adventure, TV Mysteries, TV Sci-Fi & Fantasy"
s2192,Movie,Retablo,Álvaro Delgado-Aparicio L.,"Peru, Germany, Norway",2017,"Dramas, International Movies"
s2193,TV Show,Transformers: War For Cybertron Trilogy,Unknown,United States,2020,Anime Series
s2194,Movie,Uma Maheswara Ugra Roopasya,Venkatesh Maha,India,2020,"Comedies, Dramas, Independent Movies"
s2195,TV Show,Unlucky Ploy,Nopparoj Chotmunkongsit,Unknown,2020,"International TV Shows, Romantic TV Shows, TV Comedies"
s2196,Movie,It's Her Day,Aniedi Anwah,Nigeria,2016,"Comedies, International Movies, Romantic Movies"
s2197,Movie,Redemption,Mickey Fonseca,Mozambique,2019,"Dramas, International Movies, Thrillers"
s2198,Movie,Shine Your Eyes,Matias Mariani,"Brazil, France",2020,"Dramas, Independent Movies, International Movies"
s2199,Movie,The Hater,Jan Komasa,Poland,2020,"Dramas, International Movies, Thrillers"
s2200,Movie,The Speed Cubers,Sue Kim,United States,2020,Documentaries
s2201,Movie,Tread,Paul Solet,United States,2019,Documentaries
s2202,TV Show,Last Chance U,Unknown,United States,2020,Docuseries
s2203,Movie,Banana Split,Ben Kasulke,United States,2020,"Comedies, Dramas, Independent Movies"
s2204,TV Show,Shameless (U.S.),Unknown,United States,2019,"TV Comedies, TV Dramas"
s2205,Movie,Door Ke Darshan,Gagan Puri,India,2020,"Comedies, International Movies"
s2206,Movie,Double World,Teddy Chan,China,2020,"Action & Adventure, International Movies"
s2207,Movie,Project Marathwada,Bhavin Wadia,India,2016,"Dramas, Independent Movies, International Movies"
s2208,Movie,Animal Crackers,"Tony Bancroft, Scott Christian Sava","China, Spain, South Korea, United States",2020,"Children & Family Movies, Comedies"
s2209,Movie,Dragons: Rescue Riders: Secrets of the Songwing,"Greg Rankin, TJ Sullivan",United States,2020,"Children & Family Movies, Comedies"
s2210,Movie,Nimbe,Tope Alake,Nigeria,2019,"Dramas, International Movies"
s2211,Movie,Offering to the Storm,Fernando González Molina,"Spain, Germany",2020,"International Movies, Thrillers"
s2212,Movie,Romance Doll,Yuki Tanada,Japan,2020,"Dramas, International Movies, Romantic Movies"
s2213,TV Show,Sing On! Spain,Unknown,Spain,2020,"International TV Shows, Reality TV, Spanish-Language TV Shows"
s2214,Movie,The Kissing Booth 2,Vince Marcello,"United Kingdom, United States",2020,"Comedies, Romantic Movies"
s2215,TV Show,Sinatra: All or Nothing at All,Alex Gibney,United States,2015,Docuseries
s2216,Movie,The Larva Island Movie,Ahn Byoung-wook,South Korea,2020,"Children & Family Movies, Comedies"
s2217,Movie,The Letter Reader,Sibusiso Khuzwayo,South Africa,2019,"Dramas, International Movies"
s2218,TV Show,Fear City: New York vs The Mafia,Unknown,United States,2020,"Crime TV Shows, Docuseries"
s2219,TV Show,Norsemen,Unknown,Norway,2020,"International TV Shows, TV Comedies"
s2220,Movie,The Remix: Hip Hop X Fashion,"Lisa Cortés, Farah X",United States,2019,"Documentaries, Music & Musicals"
s2221,Movie,Ip Man 4: The Finale,Wilson Yip,"Hong Kong, China",2019,"Action & Adventure, Dramas, International Movies"
s2222,Movie,Jack Whitehall: I'm Only Joking,"Dave Skinner, Freddie Waters",United Kingdom,2020,Stand-Up Comedy
s2223,TV Show,Street Food: Latin America,Unknown,Unknown,2020,"Docuseries, Spanish-Language TV Shows"
s2224,TV Show,Killer Women with Piers Morgan,Unknown,United Kingdom,2017,"British TV Shows, Crime TV Shows, Docuseries"
s2225,Movie,Funan,Denis Do,"France, Belgium, Luxembourg, Cambodia,",2018,"Dramas, International Movies"
s2226,TV Show,Gigantosaurus,Unknown,France,2019,Kids' TV
s2227,TV Show,Single Wives,Unknown,Australia,2018,"Reality TV, Romantic TV Shows"
s2228,TV Show,Cursed,Unknown,"United Kingdom, Australia",2020,"TV Action & Adventure, TV Dramas, TV Sci-Fi & Fantasy"
s2229,Movie,Father Soldier Son,"Leslye Davis, Catrin Einhorn",United States,2020,Documentaries
s2230,TV Show,In The Dark,Unknown,United States,2020,"Crime TV Shows, TV Dramas"
s2231,TV Show,Kissing Game,Unknown,Brazil,2020,"International TV Shows, TV Dramas, TV Mysteries"
s2232,Movie,The Millions,"Toka McBaror, Tunde Apalowo",Nigeria,2019,"Comedies, International Movies"
s2233,Movie,Fatal Affair,Peter Sullivan,United States,2020,Thrillers
s2234,Movie,MILF,Axelle Laffont,"France, Belgium",2018,"Comedies, International Movies, Romantic Movies"
s2235,Movie,Cold Feet,Moses Inwang,Nigeria,2019,"Dramas, International Movies, Romantic Movies"
s2236,TV Show,Dark Desire,Unknown,Mexico,2020,"Crime TV Shows, International TV Shows, Spanish-Language TV Shows"
s2237,Movie,Little Singham: Legend of Dugabakka,Unknown,Unknown,2020,"Children & Family Movies, Comedies"
s2238,TV Show,Skin Decision: Before and After,Unknown,United States,2020,"Reality TV, Science & Nature TV"
s2239,TV Show,Sunny Bunnies,Unknown,Belarus,2016,"British TV Shows, Kids' TV, TV Comedies"
s2240,Movie,Sylvia,Daniel Oriahi,Nigeria,2018,"Dramas, International Movies, Thrillers"
s2241,Movie,The Players,Stefano Mordini,Italy,2020,"Comedies, International Movies"
s2242,TV Show,The Business of Drugs,Unknown,United States,2020,Docuseries
s2243,Movie,Urzila Carlson: Overqualified Loser,Hayden Guppy,Australia,2020,Stand-Up Comedy
s2244,Movie,We Are One,Stéphane de Freitas,France,2020,"Documentaries, International Movies, Music & Musicals"
s2245,Movie,Hole in the Wall,"André Odendaal, Johan Vorster",South Africa,2016,"Dramas, International Movies"
s2246,TV Show,Dating Around: Brazil,Cassia Dian,Brazil,2020,"International TV Shows, Reality TV, Romantic TV Shows"
s2247,TV Show,Down to Earth with Zac Efron,Unknown,United States,2020,"Docuseries, Reality TV, Science & Nature TV"
s2248,Movie,Mama's Boy,Amro Salah,Egypt,2018,"Comedies, International Movies"
s2249,Movie,The Claudia Kishi Club,Sue Ding,United States,2020,Documentaries
s2250,TV Show,The Epic Tales of Captain Underpants in Space,Unknown,United States,2020,"Kids' TV, TV Action & Adventure, TV Comedies"
s2251,Movie,The Old Guard,Gina Prince-Bythewood,United States,2020,Action & Adventure
s2252,TV Show,The Twelve,Wouter Bouvijn,Belgium,2019,"Crime TV Shows, International TV Shows, TV Dramas"
s2253,Movie,Your Excellency,Funke Akindele,Unknown,2019,"Comedies, International Movies"
s2254,TV Show,Japan Sinks: 2020,Unknown,Japan,2020,"Anime Series, International TV Shows"
s2255,TV Show,The Protector,Unknown,Turkey,2020,"International TV Shows, Romantic TV Shows, TV Action & Adventure"
s2256,TV Show,Was It Love?,Unknown,South Korea,2020,"International TV Shows, Korean TV Shows, Romantic TV Shows"
s2257,Movie,Born Racer,Bryn Evans,New Zealand,2018,"Documentaries, Sports Movies"
s2258,Movie,Mucho Mucho Amor: The Legend of Walter Mercado,"Cristina Costantini, Kareem Tabsch",United States,2020,"Documentaries, LGBTQ Movies"
s2259,TV Show,Stateless,Unknown,Australia,2020,"International TV Shows, TV Dramas"
s2260,Movie,The Long Dumb Road,Hannah Fidell,United States,2018,"Comedies, Independent Movies"
s2261,Movie,Dr. Seuss' The Lorax,"Chris Renaud, Kyle Balda","United States, France",2012,Children & Family Movies
s2262,Movie,Jim Jefferies: Intolerant,Scott Zabielski,Unknown,2020,Stand-Up Comedy
s2263,Movie,A Kid from Coney Island,"Coodie, Chike","United States, China",2019,"Documentaries, Sports Movies"
s2264,Movie,PNL - Dans la légende tour,QLF,Unknown,2020,"International Movies, Music & Musicals"
s2265,Movie,Aiyyaa,Sachin Kundalkar,India,2012,"Comedies, International Movies, Music & Musicals"
s2266,Movie,Bbuddah Hoga Terra Baap,Puri Jagannadh,India,2011,"Action & Adventure, Comedies, Dramas"
s2267,Movie,Blood Money,Vishal Mahadkar,India,2012,"Dramas, International Movies, Romantic Movies"
s2268,Movie,Bombay Talkies,"Anurag Kashyap, Dibakar Banerjee, Karan Johar, Zoya Akhtar",India,2013,"Dramas, International Movies"
s2269,Movie,Boss,Anthony D'Souza,India,2013,"Action & Adventure, Comedies, Dramas"
s2270,Movie,Budhia Singh: Born to Run,Soumendra Padhi,India,2016,"Dramas, Independent Movies, International Movies"
s2271,Movie,Chashme Baddoor,David Dhawan,India,2013,"Comedies, International Movies, Music & Musicals"
s2272,Movie,Dharam Sankat Mein,Fuwad Khan,India,2015,"Comedies, Dramas, International Movies"
s2273,Movie,Drishyam,Nishikant Kamat,India,2015,"Dramas, International Movies, Thrillers"
s2274,Movie,Gabbar Is Back,Krish,India,2015,"Action & Adventure, Dramas, International Movies"
s2275,Movie,Gollu Aur Pappu,Kabir Sadanand,India,2014,"Action & Adventure, Comedies, International Movies"
s2276,TV Show,Hook,Rachit Kusonkoonsiri,Thailand,2020,"International TV Shows, Romantic TV Shows, TV Comedies"
s2277,Movie,Inkaar,Sudhir Mishra,India,2013,"Dramas, International Movies, Romantic Movies"
s2278,Movie,Madras Café,Shoojit Sircar,India,2013,"Dramas, International Movies, Thrillers"
s2279,Movie,Mary Kom,Omung Kumar,India,2014,"Dramas, International Movies, Sports Movies"
s2280,Movie,Michael,Ribhu Dasgupta,India,2011,"Dramas, Independent Movies, International Movies"
s2281,Movie,Mumbai Delhi Mumbai,Satish Rajwade,India,2014,"Comedies, International Movies, Romantic Movies"
s2282,Movie,Oh My God,Umesh Shukla,India,2012,"Comedies, Dramas, International Movies"
s2283,Movie,One by Two,Devika Bhagat,India,2014,"Comedies, Dramas, International Movies"
s2284,Movie,Only,Takashi Doscher,United States,2019,"Dramas, Independent Movies, Romantic Movies"
s2285,Movie,Penalty,Shubham Singh,India,2019,"Dramas, Independent Movies, International Movies"
s2286,Movie,Players,"Abbas Alibhai Burmawalla, Mastan Alibhai Burmawalla",India,2012,"Action & Adventure, International Movies"
s2287,Movie,Pyaar Ka Punchnama 2,Luv Ranjan,India,2015,"Comedies, Dramas, International Movies"
s2288,Movie,Queen,Vikas Bahl,India,2014,"Comedies, Dramas, International Movies"
s2289,Movie,Shaitan,Bejoy Nambiar,India,2011,"Action & Adventure, Dramas, Independent Movies"
s2290,Movie,Special 26,Neeraj Pandey,India,2013,"Dramas, International Movies, Thrillers"
s2291,Movie,Tanu Weds Manu,Aanand Rai,India,2011,"Comedies, Dramas, International Movies"
s2292,Movie,What the Fish,Gurmmeet Singh,India,2013,"Comedies, International Movies"
s2293,TV Show,Little Singham,Unknown,India,2020,"Kids' TV, TV Comedies"
s2294,TV Show,Cable Girls,Unknown,Spain,2019,"International TV Shows, Romantic TV Shows, Spanish-Language TV Shows"
s2295,Movie,Desperados,LP,United States,2020,"Comedies, Romantic Movies"
s2296,Movie,Hunter in the Blue Side of Manchester,Rako Prijanto,"Indonesia, United Kingdom",2020,"Dramas, International Movies"
s2297,Movie,I Am Not Your Negro,Raoul Peck,"Switzerland, France, Belgium, United States",2017,Documentaries
s2298,TV Show,JU-ON: Origins,Unknown,Japan,2020,"International TV Shows, TV Horror, TV Mysteries"
s2299,TV Show,Southern Survival,Unknown,United States,2020,Reality TV
s2300,TV Show,The Baby-Sitters Club,Unknown,United States,2020,"Kids' TV, TV Dramas"
s2301,Movie,The Perfect Picture: Ten Years Later,Shirley Frimpong-Manso,Ghana,2019,"Comedies, Dramas, International Movies"
s2302,TV Show,Supermarket Sweep,Unknown,United States,1993,Reality TV
s2303,Movie,Thiago Ventura: POKAS,"Fabio Ock, Joana Mazzucchelli",Brazil,2020,Stand-Up Comedy
s2304,TV Show,Warrior Nun,Unknown,United States,2020,"TV Action & Adventure, TV Mysteries, TV Sci-Fi & Fantasy"
s2305,Movie,#AnneFrank - Parallel Stories,"Sabina Fedeli, Anna Migotto",Italy,2019,"Documentaries, International Movies"
s2306,TV Show,21 Again,Unknown,United Kingdom,2019,"British TV Shows, Reality TV"
s2307,TV Show,A Touch of Green,Unknown,Taiwan,2016,"International TV Shows, TV Dramas"
s2308,TV Show,Abby Hatcher,Kyran Kelly,"United States, Canada",2019,Kids' TV
s2309,Movie,Adú,Salvador Calvo,Spain,2020,"Dramas, International Movies"
s2310,Movie,Ali Baba ve 7 Cüceler,Cem Yılmaz,Turkey,2015,"Action & Adventure, Comedies, International Movies"
s2311,Movie,David Foster: Off the Record,Barry Avrich,Canada,2019,"Documentaries, Music & Musicals"
s2312,Movie,Double Jeopardy,Bruce Beresford,"United States, Germany, Canada",1999,Thrillers
s2313,Movie,Pek Yakında,Cem Yılmaz,Turkey,2014,"Comedies, International Movies"
s2314,TV Show,Say I Do,Unknown,United States,2020,"Reality TV, Romantic TV Shows"
s2315,Movie,Stardust,Matthew Vaughn,"United Kingdom, United States",2007,"Action & Adventure, International Movies, Romantic Movies"
s2316,Movie,The F**k-It List,Michael Duggan,United States,2019,Comedies
s2317,Movie,The Silence of Others,"Almudena Carracedo, Robert Bahar","Spain, France, Canada, United States",2019,"Documentaries, International Movies"
s2318,Movie,Total Recall,Paul Verhoeven,"United States, Mexico",1990,"Action & Adventure, Sci-Fi & Fantasy"
s2319,TV Show,Trotro,Unknown,France,2004,Kids' TV
s2320,Movie,Under the Riccione Sun,Younuts!,Italy,2020,"Comedies, International Movies, Romantic Movies"
s2321,TV Show,BNA,Unknown,Japan,2020,"Anime Series, International TV Shows"
s2322,Movie,George Lopez: We'll Do It For Half,Troy Miller,United States,2020,Stand-Up Comedy
s2323,TV Show,Homemade,Unknown,"Chile, Italy",2020,"International TV Shows, TV Dramas"
s2324,Movie,The Mirror Boy,Obi Emelonye,"United Kingdom, Nigeria",2011,"Action & Adventure, Dramas, International Movies"
s2325,Movie,#FriendButMarried 2,Rako Prijanto,Indonesia,2020,"Dramas, International Movies, Romantic Movies"
s2326,Movie,Skin,Daniel Effiong,Nigeria,2019,"Documentaries, International Movies"
s2327,Movie,Thackeray (Marathi),Abhijit Panse,Unknown,2019,"Dramas, International Movies"
s2328,TV Show,Dark,Unknown,"Germany, United States",2020,"Crime TV Shows, International TV Shows, TV Dramas"
s2329,Movie,Ride Like a Girl,Rachel Griffiths,Australia,2020,"Children & Family Movies, Dramas, Independent Movies"
s2330,TV Show,All For Love,Unknown,Colombia,2020,"International TV Shows, Romantic TV Shows, Spanish-Language TV Shows"
s2331,Movie,Eurovision Song Contest: The Story of Fire Saga,David Dobkin,United States,2020,"Comedies, Music & Musicals, Romantic Movies"
s2332,TV Show,Home Game,Unknown,United States,2020,Docuseries
s2333,Movie,Kasanova,Oluseyi Asurf,Nigeria,2019,"Comedies, International Movies, Romantic Movies"
s2334,Movie,Ordinary People,Eduardo Roy Jr.,Philippines,2016,"Dramas, Independent Movies, International Movies"
s2335,Movie,Seven (Tamil),Unknown,India,2019,"Dramas, International Movies, Romantic Movies"
s2336,Movie,Seven (Telugu),Unknown,Unknown,2019,"Dramas, International Movies, Romantic Movies"
s2337,Movie,Thackeray (Hindi),Abhijit Panse,India,2019,"Dramas, International Movies"
s2338,TV Show,Twogether,Unknown,South Korea,2020,"International TV Shows, Korean TV Shows, Reality TV"
s2339,Movie,Krishna and His Leela,Ravikanth Perepu,India,2020,"International Movies, Romantic Movies"
s2340,Movie,Prem Ratan Dhan Payo,Sooraj R. Barjatya,India,2015,"Action & Adventure, Dramas, International Movies"
s2341,Movie,Vivah,Sooraj R. Barjatya,India,2006,"Dramas, International Movies, Romantic Movies"
s2342,Movie,Athlete A,"Bonni Cohen, Jon Shenk",United States,2020,"Documentaries, Sports Movies"
s2343,Movie,Bulbbul,Anvita Dutt,India,2020,"Horror Movies, International Movies"
s2344,TV Show,Crazy Delicious,Unknown,United Kingdom,2020,"British TV Shows, International TV Shows, Reality TV"
s2345,Movie,Nobody Knows I'm Here,Gaspar Antillo,Chile,2020,"Dramas, Independent Movies, International Movies"
s2346,Movie,Eric Andre: Legalize Everything,Eric Notarnicola,United States,2020,Stand-Up Comedy
s2347,TV Show,"Roswell, New Mexico",Unknown,United States,2020,"Classic & Cult TV, TV Dramas, TV Sci-Fi & Fantasy"
s2348,Movie,Kappela,Musthafa,India,2020,"Dramas, Independent Movies, International Movies"
s2349,Movie,The Royal Hibiscus Hotel,Ishaya Bako,Nigeria,2017,"Comedies, International Movies, Romantic Movies"
s2350,TV Show,It's Okay to Not Be Okay,Unknown,South Korea,2020,"International TV Shows, Korean TV Shows, Romantic TV Shows"
s2351,Movie,Woodshock,"Kate Mulleavy, Laura Mulleavy",United States,2017,"Dramas, Independent Movies, Thrillers"
s2352,Movie,Elevator Baby,Akhigbe Ilozobhie,Nigeria,2019,"Dramas, International Movies"
s2353,TV Show,Babies,Unknown,United States,2020,"Docuseries, Science & Nature TV"
s2354,Movie,Chaman Bahaar,Apurva Dhar Badgaiyann,India,2020,"Comedies, Dramas, International Movies"
s2355,Movie,Destiny,Youssef Chahine,"France, Egypt",1997,"Dramas, International Movies"
s2356,Movie,Disclosure,Unknown,United States,2020,"Documentaries, LGBTQ Movies"
s2357,Movie,Feel the Beat,Elissa Down,United States,2020,"Children & Family Movies, Comedies, Dramas"
s2358,TV Show,Floor Is Lava,Unknown,United States,2020,Reality TV
s2359,Movie,Lost Bullet,Guillaume Pierret,France,2020,"Action & Adventure, Dramas, International Movies"
s2360,TV Show,Most Beautiful Thing,Unknown,Brazil,2020,"International TV Shows, Romantic TV Shows, TV Dramas"
s2361,Movie,One-Way to Tomorrow,Ozan Açıktan,Turkey,2020,"Dramas, International Movies, Romantic Movies"
s2362,Movie,The Emigrant,Youssef Chahine,"Egypt, France",1994,"Dramas, International Movies"
s2363,TV Show,The Politician,Unknown,United States,2020,"TV Comedies, TV Dramas, Teen TV Shows"
s2364,Movie,Wasp Network,Olivier Assayas,"France, Brazil, Spain, Belgium",2020,"Dramas, International Movies, Thrillers"
s2365,Movie,A Whisker Away,"Junichi Sato, Tomotaka Shibayama",Japan,2020,"Anime Features, Children & Family Movies, International Movies"
s2366,Movie,Alexandria ... Why?,Youssef Chahine,"Egypt, Algeria",1979,"Classic Movies, Dramas, International Movies"
