show_id,type,title,director,country,release_year,listed_in
s4163,TV Show,A Taiwanese Tale of Two Cities,Unknown,Taiwan,2018,"International TV Shows, TV Dramas"
s4164,TV Show,Z Nation,Unknown,United States,2018,"TV Action & Adventure, TV Comedies, TV Horror"
s4165,Movie,Goyo: The Boy General,Jerrold Tarog,Philippines,2018,"Dramas, International Movies"
s4166,Movie,Animas,"Laura Alvea, José Ortuño","Spain, Belgium",2018,"Horror Movies, International Movies"
s4167,TV Show,Black Earth Rising,Unknown,United Kingdom,2018,"British TV Shows, International TV Shows, TV Dramas"
s4168,TV Show,Club of Crows,Unknown,Mexico,2019,"International TV Shows, Spanish-Language TV Shows, TV Comedies"
s4169,TV Show,Examination of Conscience,Unknown,Spain,2019,"Crime TV Shows, Docuseries, International TV Shows"
s4170,Movie,Mi Obra Maestra,Gastón Duprat,"Argentina, Spain",2018,"Comedies, International Movies"
s4171,Movie,Polar,Unknown,"United States, Germany",2019,"Action & Adventure, International Movies"
s4172,TV Show,The Perfect Match,Unknown,Unknown,2017,"International TV Shows, Romantic TV Shows, TV Comedies"
s4173,TV Show,Conversations with a Killer: The Ted Bundy Tapes,Unknown,United States,2019,"Crime TV Shows, Docuseries"
s4174,Movie,Just Love,"Andy Caballero, Diego Corsini",Argentina,2018,"Dramas, International Movies, Music & Musicals"
s4175,TV Show,Innocent,Seren Yüce,Turkey,2017,"Crime TV Shows, International TV Shows, TV Dramas"
s4176,Movie,Close,Unknown,"United Kingdom, United States",2019,"Action & Adventure, International Movies"
s4177,Movie,FYRE: The Greatest Party That Never Happened,Chris Smith,United States,2019,Documentaries
s4178,Movie,IO,Jonathan Helpert,United States,2019,"Dramas, Sci-Fi & Fantasy"
s4179,TV Show,Marvel's The Punisher,Unknown,United States,2019,"Crime TV Shows, TV Action & Adventure, TV Thrillers"
s4180,TV Show,Memory Love,Unknown,Unknown,2017,"International TV Shows, Romantic TV Shows, TV Dramas"
s4181,Movie,Old Lord Savanna,André D'Elia,Brazil,2018,"Documentaries, International Movies"
s4182,Movie,Patria,Matías Gueilburt,Mexico,2019,"Documentaries, International Movies"
s4183,Movie,Soni,Ivan Ayr,India,2018,"Dramas, Independent Movies, International Movies"
s4184,TV Show,The World's Most Extraordinary Homes,Unknown,United Kingdom,2019,"British TV Shows, Docuseries, International TV Shows"
s4185,TV Show,Trigger Warning with Killer Mike,Unknown,Unknown,2019,"Docuseries, Stand-Up Comedy & Talk Shows"
s4186,Movie,Abducted in Plain Sight,Skye Borgman,United States,2017,Documentaries
s4187,Movie,"Abdullah, The Final Witness",Hashim Nadeem Khan,Pakistan,2016,"Dramas, International Movies"
s4188,Movie,Adhugo,Unknown,India,2018,"Comedies, Independent Movies, International Movies"
s4189,Movie,Echcharikkai,Sarjun,India,2018,"International Movies, Thrillers"
s4190,TV Show,Lavender,Unknown,Taiwan,2002,"International TV Shows, Romantic TV Shows, TV Dramas"
s4191,Movie,Pandigai,Feroz,India,2017,"Action & Adventure, Dramas, International Movies"
s4192,Movie,Pari,Syed Atif Ali,Pakistan,2018,"Horror Movies, International Movies"
s4193,Movie,Revenger,Lee Seung-won,South Korea,2018,"Action & Adventure, International Movies"
s4194,Movie,Sebastian Maniscalco: Stay Hungry,Rik Reinholdtsen,United States,2019,Stand-Up Comedy
s4195,Movie,The Doll,Rocky Soraya,Indonesia,2016,"Horror Movies, International Movies"
s4196,Movie,The Doll 2,Rocky Soraya,Indonesia,2017,"Horror Movies, International Movies"
s4197,TV Show,La Grande Chaumière Violette,Unknown,Taiwan,2016,"International TV Shows, TV Dramas"
s4198,Movie,Baazaar,Gauravv K Chawla,India,2018,"Dramas, International Movies"
s4199,Movie,All of You,Dan Villegas,Philippines,2017,"Comedies, Dramas, International Movies"
s4200,TV Show,Back with the Ex,Unknown,Unknown,2018,"International TV Shows, Reality TV, Romantic TV Shows"
s4201,TV Show,Friends from College,Unknown,United States,2019,"Romantic TV Shows, TV Comedies"
s4202,TV Show,Hardy Bucks,Unknown,Ireland,2018,TV Comedies
s4203,TV Show,Horrid Henry,Unknown,United Kingdom,2019,"British TV Shows, Kids' TV, TV Comedies"
s4204,Movie,ReMastered: Massacre at the Stadium,Bent-Jorgen Perlmutt,United States,2019,"Documentaries, Music & Musicals"
s4205,Movie,Solo,Hugo Stuven,Spain,2018,"Dramas, Independent Movies, International Movies"
s4206,Movie,The Last Laugh,Greg Pritikin,United States,2019,"Comedies, Dramas"
s4207,TV Show,Pocoyo,Unknown,"Spain, United Kingdom",2017,"Kids' TV, Spanish-Language TV Shows"
s4208,TV Show,When Heroes Fly,Unknown,Israel,2018,"International TV Shows, TV Action & Adventure, TV Dramas"
s4209,Movie,GODZILLA The Planet Eater,"Kobun Shizuno, Hiroyuki Seshita",Japan,2018,"Action & Adventure, Anime Features, International Movies"
s4210,Movie,Next Enti?,Kunal Kohli,India,2018,"Comedies, Dramas, International Movies"
s4211,Movie,Komola Rocket,Noor Imran Mithu,Bangladesh,2018,"Dramas, Independent Movies, International Movies"
s4212,Movie,Nang Nak,Nonzee Nimibutr,Thailand,1999,"Horror Movies, International Movies, Romantic Movies"
s4213,Movie,And Breathe Normally,Ísold Uggadóttir,"Iceland, Sweden, Belgium",2018,"Dramas, Independent Movies, International Movies"
s4214,Movie,El Potro: Unstoppable,Lorena Munoz,Unknown,2018,"Dramas, International Movies, Music & Musicals"
s4215,Movie,Lionheart,Genevieve Nnaji,Nigeria,2018,"Comedies, Dramas, Independent Movies"
s4216,TV Show,See You in Time,Unknown,Unknown,2017,"International TV Shows, Romantic TV Shows, TV Dramas"
s4217,TV Show,Déjà Vu,Unknown,Unknown,2013,"International TV Shows, Romantic TV Shows, TV Dramas"
s4218,Movie,Monty Python and the Holy Grail,"Terry Gilliam, Terry Jones",United Kingdom,1975,"Action & Adventure, Classic Movies, Comedies"
s4219,TV Show,A Series of Unfortunate Events,Unknown,United States,2019,"Kids' TV, TV Action & Adventure, TV Comedies"
s4220,Movie,Back to the 90s,Yanyong Kuruaungkoul,Thailand,2015,"Comedies, International Movies, Music & Musicals"
s4221,TV Show,COMEDIANS of the world,Unknown,United States,2019,"Stand-Up Comedy & Talk Shows, TV Comedies"
s4222,Movie,Merku Thodarchi Malai,Lenin Bharathi,India,2018,"Dramas, Independent Movies, International Movies"
s4223,Movie,Moshe Kasher: Live in Oakland,Jay Chapman,United States,2012,Stand-Up Comedy
s4224,Movie,Pokémon the Movie: I Choose You!,Kunihiko Yuyama,Japan,2017,"Anime Features, Children & Family Movies"
s4225,Movie,Puriyatha Puthir,Ranjit Jeyakodi,India,2017,"International Movies, Thrillers"
s4226,Movie,Taramani,Ram,India,2017,"Dramas, Independent Movies, International Movies"
s4227,TV Show,The Paper,Unknown,Croatia,2018,"International TV Shows, TV Dramas"
s4228,TV Show,Tidying Up with Marie Kondo,Unknown,United States,2019,Reality TV
s4229,Movie,Whitney Cummings: Money Shot,John Fortenberry,United States,2010,Stand-Up Comedy
s4230,Movie,Bill Hicks: One Night Stand,John Fortenberry,United Kingdom,1991,Stand-Up Comedy
s4231,Movie,Bill Hicks: Reflections,Unknown,Unknown,2015,Documentaries
s4232,Movie,Bill Hicks: Relentless,Chris Bould,United Kingdom,1992,Stand-Up Comedy
s4233,Movie,Bill Hicks: Revelations,Chris Bould,United Kingdom,1993,Stand-Up Comedy
s4234,Movie,Bill Hicks: Sane Man,"Kevin Booth, David Johndrow",United States,1989,Stand-Up Comedy
s4235,Movie,Gina Yashere: Laughing to America,Paul M. Green,Unknown,2013,Stand-Up Comedy
s4236,Movie,Gina Yashere: Skinny B*tch,Unknown,United Kingdom,2008,Stand-Up Comedy
s4237,Movie,Mexicanos de Bronce,Julio Fernández Talamantes,Mexico,2016,"Documentaries, International Movies, Music & Musicals"
s4238,Movie,Sam Kinison: Breaking the Rules,Walter C. Miller,United States,1987,Stand-Up Comedy
s4239,Movie,Sam Kinison: Family Entertainment Hour,Walter C. Miller,United States,1991,Stand-Up Comedy
s4240,Movie,Sam Kinison: Live in Vegas,Walter C. Miller,United States,1991,Stand-Up Comedy
s4241,Movie,Sam Kinison: The Scream Continues,Unknown,United States,2016,Documentaries
s4242,Movie,Secrets in the Hot Spring,Unknown,Taiwan,2018,"Comedies, Horror Movies, International Movies"
s4243,Movie,Taylor Swift reputation Stadium Tour,Paul Dugdale,Unknown,2018,Music & Musicals
s4244,Movie,The Seven Deadly Sins the Movie: Prisoners of the Sky,Noriyuki Abe,Japan,2018,"Action & Adventure, Anime Features, International Movies"
s4245,Movie,Tim Allen: Men Are Pigs,Ellen Brown,United States,1990,Stand-Up Comedy
s4246,Movie,Tim Allen: ReWires America,Unknown,United States,1991,Stand-Up Comedy
s4247,Movie,Tim Minchin And The Heritage Orchestra Live,Matt Askem,United Kingdom,2011,"Music & Musicals, Stand-Up Comedy"
s4248,Movie,Tim Minchin: So F**king Rock,Matt Askem,United Kingdom,2008,"Music & Musicals, Stand-Up Comedy"
s4249,Movie,Todd Glass: Stand-Up Special,Jay Chapman,United States,2012,Stand-Up Comedy
s4250,Movie,Tom Papa Live in New York City,Rob Zombie,United States,2011,Stand-Up Comedy
s4251,TV Show,Pioneers: First Women Filmmakers*,Unknown,Unknown,1925,TV Shows
s4252,TV Show,In Family We Trust,Unknown,Thailand,2018,"Crime TV Shows, International TV Shows, TV Dramas"
s4253,Movie,A Twelve Year Night,Álvaro Brechner,"Uruguay, Argentina, Spain",2018,"Dramas, International Movies"
s4254,Movie,Black Mirror: Bandersnatch,Unknown,United States,2018,"Dramas, International Movies, Sci-Fi & Fantasy"
s4255,TV Show,Hashoter Hatov,Unknown,Israel,2015,"Crime TV Shows, International TV Shows, TV Comedies"
s4256,Movie,Life Ki Toh Lag Gayi,Rakesh Mehta,India,2012,"Action & Adventure, Comedies, Dramas"
s4257,TV Show,Murder Mountain,Unknown,United States,2018,"Crime TV Shows, Docuseries"
s4258,TV Show,Selection Day,Unknown,India,2018,"International TV Shows, TV Dramas, Teen TV Shows"
s4259,Movie,The Birth Reborn 3,Eduardo Chauvet,Unknown,2018,"Documentaries, International Movies"
s4260,Movie,When Angels Sleep,Gonzalo Bendala,Spain,2018,"Dramas, International Movies, Thrillers"
s4261,TV Show,Stand Up and Away! with Brian Regan,Unknown,United States,2018,"Stand-Up Comedy & Talk Shows, TV Comedies"
s4262,TV Show,Way Back into Love,Unknown,Taiwan,2011,"International TV Shows, Romantic TV Shows, TV Comedies"
s4263,TV Show,Watership Down,Noam Murro,"United Kingdom, Ireland, United States",2018,"British TV Shows, International TV Shows, TV Action & Adventure"
s4264,TV Show,Demon's Path,Unknown,Unknown,2018,"Crime TV Shows, International TV Shows, TV Dramas"
s4265,TV Show,People Just Do Nothing,Unknown,United Kingdom,2018,"British TV Shows, TV Comedies"
s4266,TV Show,Single Ladies Senior,Unknown,Unknown,2018,"International TV Shows, Romantic TV Shows, TV Dramas"
s4267,TV Show,7 Days Out,Unknown,United States,2018,Docuseries
s4268,Movie,Bad Seeds,Kheiron,"France, Belgium",2018,"Comedies, Dramas, International Movies"
s4269,Movie,Bird Box,Susanne Bier,United States,2018,"Dramas, Sci-Fi & Fantasy, Thrillers"
s4270,TV Show,Jojo's World,Unknown,Taiwan,2017,"International TV Shows, Romantic TV Shows, TV Comedies"
s4271,TV Show,LAST HOPE,Unknown,Japan,2018,"Anime Series, International TV Shows"
s4272,TV Show,Lion Pride,Unknown,Taiwan,2017,"International TV Shows, Romantic TV Shows, TV Comedies"
s4273,TV Show,Love @ Seventeen,Unknown,Taiwan,2016,"International TV Shows, Romantic TV Shows, TV Dramas"
s4274,TV Show,Perfume,Unknown,Germany,2018,"Crime TV Shows, International TV Shows, TV Dramas"
s4275,TV Show,Sirius the Jaeger,Unknown,Japan,2018,"Anime Series, International TV Shows, TV Thrillers"
s4276,Movie,Struggle: The Life and Lost Art of Szukalski,Irek Dobrowolski,"Poland, United States",2018,Documentaries
s4277,TV Show,Wolf,Unknown,Turkey,2018,"International TV Shows, TV Action & Adventure, TV Dramas"
s4278,Movie,23:59,Gilbert Chan,Singapore,2011,"Horror Movies, International Movies"
s4279,Movie,Aggretsuko: We Wish You a Metal Christmas,Rarecho,Japan,2018,Movies
s4280,TV Show,Fate/stay night: Unlimited Blade Works,Unknown,Japan,2015,"Anime Series, International TV Shows"
s4281,Movie,Imperfect,Steve Cheng,Singapore,2012,"Action & Adventure, International Movies"
s4282,Movie,Lang Tong,Sam Loh,Singapore,2015,"International Movies, Thrillers"
s4283,Movie,Miss J Contemplates Her Choice,Jason Lai,Singapore,2014,"Dramas, International Movies, Thrillers"
s4284,Movie,Ascharyachakit!,Samit Kakkad,India,2018,"Dramas, Independent Movies, International Movies"
s4285,TV Show,Ellen DeGeneres: Relatable,"Joel Gallen, Tig Notaro",United States,2018,"Stand-Up Comedy & Talk Shows, TV Comedies"
s4286,Movie,Lilli,Prasobh Vijayan,India,2018,"Dramas, Independent Movies, International Movies"
s4287,Movie,Prince of Peoria: A Christmas Moose Miracle,Jon Rosenbaum,United States,2018,"Children & Family Movies, Comedies"
s4288,Movie,Andhadhun,Sriram Raghavan,India,2018,"Comedies, Dramas, International Movies"
s4289,TV Show,Ashes of Love,Unknown,China,2018,"International TV Shows, Romantic TV Shows, TV Comedies"
s4290,Movie,Dragons: Dawn of the Dragon Racers,"Elaine Bogan, John Sanford",United States,2014,"Children & Family Movies, Comedies"
s4291,TV Show,DreamWorks Holiday Classics,Unknown,United States,2011,"Kids' TV, TV Comedies"
s4292,Movie,Kill the Messenger,Michael Cuesta,United States,2014,"Dramas, Thrillers"
s4293,Movie,Maps to the Stars,David Cronenberg,"Canada, Germany, France, United States",2014,"Comedies, Dramas"
s4294,Movie,Springsteen on Broadway,Thom Zimny,United States,2018,Music & Musicals
s4295,Movie,The Theory of Everything,James Marsh,"United Kingdom, Japan",2014,"Dramas, Romantic Movies"
s4296,Movie,F.R.E.D.I.,Sean Olson,United States,2018,"Children & Family Movies, Sci-Fi & Fantasy"
s4297,TV Show,Flowers,Unknown,United Kingdom,2018,"British TV Shows, International TV Shows, TV Comedies"
s4298,Movie,Kita Kita,Sigrid Andrea Bernardo,Philippines,2017,"Comedies, Dramas, International Movies"
s4299,Movie,Once in a Lifetime Sessions with George Ezra,Unknown,United States,2018,"Documentaries, Music & Musicals"
s4300,Movie,Once in a Lifetime Sessions with Kasabian,Matt Askem,United States,2018,"Documentaries, Music & Musicals"
s4301,Movie,Once in a Lifetime Sessions with OneRepublic,Unknown,United States,2018,"Documentaries, Music & Musicals"
s4302,Movie,Once in a Lifetime Sessions with Snow Patrol,Matt Askem,United States,2018,"Documentaries, Music & Musicals"
s4303,Movie,Sad Hill Unearthed,Guillermo de Oliveira,Spain,2017,"Documentaries, International Movies"
s4304,Movie,Vanjagar Ulagam,Manoj Beedha,India,2018,"Dramas, International Movies, Thrillers"
s4305,TV Show,Hymn of Death,Unknown,South Korea,2018,"International TV Shows, Korean TV Shows, Romantic TV Shows"
s4306,TV Show,Inside the Real Narcos,Unknown,Unknown,2018,"British TV Shows, Crime TV Shows, Docuseries"
s4307,Movie,ROMA,Alfonso Cuarón,"Mexico, United States",2018,"Dramas, Independent Movies, International Movies"
s4308,TV Show,The Fix,Unknown,United States,2018,TV Comedies
s4309,TV Show,The Innocent Man,Unknown,United States,2018,"Crime TV Shows, Docuseries"
s4310,TV Show,Tidelands,Unknown,Australia,2018,"Crime TV Shows, International TV Shows, TV Dramas"
s4311,TV Show,Travelers,Unknown,"Canada, United States",2018,"Crime TV Shows, International TV Shows, TV Dramas"
s4312,TV Show,Voltron: Legendary Defender,Unknown,United States,2018,Kids' TV
s4313,TV Show,Back Street Girls -GOKUDOLS-,Unknown,Japan,2018,"Anime Series, International TV Shows"
s4314,Movie,"Out of Many, One","John Hoffman, Nanfu Wang",United States,2018,Documentaries
s4315,Movie,Vir Das: Losing It,Marcus Raboy,United States,2018,Stand-Up Comedy
s4316,Movie,5 Star Christmas,Marco Risi,Italy,2018,"Comedies, International Movies"
s4317,TV Show,Dogs of Berlin,Unknown,Germany,2018,"Crime TV Shows, International TV Shows, TV Dramas"
s4318,Movie,Dumplin',Anne Fletcher,United States,2018,"Comedies, Dramas, Independent Movies"
s4319,Movie,Free Rein: The Twelve Neighs of Christmas,Marek Losey,Unknown,2018,"Children & Family Movies, Dramas"
s4320,Movie,Mowgli: Legend of the Jungle,Andy Serkis,"United Kingdom, United States",2018,"Action & Adventure, Children & Family Movies, Dramas"
s4321,TV Show,Neo Yokio,Unknown,United States,2018,"TV Comedies, TV Sci-Fi & Fantasy, Teen TV Shows"
s4322,TV Show,Pine Gap,Mat King,Australia,2018,"International TV Shows, TV Dramas"
s4323,Movie,ReMastered: Who Killed Jam Master Jay?,Brian Oakes,Unknown,2018,"Documentaries, Music & Musicals"
s4324,Movie,Super Monsters and the Wish Star,Jacob Joice,Unknown,2018,Children & Family Movies
s4325,Movie,The American Meme,Bert Marcus,United States,2018,Documentaries
s4326,Movie,RUSSELL BRAND: RE:BIRTH,Chris Howe,Unknown,2018,Stand-Up Comedy
s4327,TV Show,The Sound of Your Heart: Reboot,Unknown,South Korea,2018,"International TV Shows, Korean TV Shows, TV Comedies"
s4328,TV Show,Memories of the Alhambra,Unknown,South Korea,2018,"Crime TV Shows, International TV Shows, Korean TV Shows"
s4329,Movie,Teefa in Trouble,Ahsan Rahim,Pakistan,2018,"Action & Adventure, Comedies, International Movies"
s4330,Movie,A Beautiful Life,Andrew Lau Wai-Keung,"China, Hong Kong",2011,"Dramas, International Movies, Romantic Movies"
s4331,Movie,Accident,Cheang Pou Soi,Hong Kong,2009,"International Movies, Thrillers"
s4332,Movie,"Ayotzinapa, el paso de la tortuga",Enrique García Meza,Mexico,2018,"Documentaries, International Movies"
s4333,Movie,Battle,Katarina Launing,"Norway, Denmark, Netherlands, Sweden",2018,"Dramas, International Movies, Romantic Movies"
s4334,Movie,Blind Detective,Johnnie To,"Hong Kong, China",2013,"Action & Adventure, Comedies, International Movies"
s4335,Movie,Break Up 100,Lawrence Cheng,Hong Kong,2014,"Comedies, International Movies, Romantic Movies"
s4336,Movie,Chal Bhaag,Prakash Balwant Saini,India,2014,"Comedies, Dramas, International Movies"
s4337,Movie,Crossroads: One Two Jaga,Nam Ron,Malaysia,2018,"Dramas, International Movies"
s4338,Movie,Don't Go Breaking My Heart,Johnnie To,Hong Kong,2011,"Comedies, International Movies, Romantic Movies"
s4339,Movie,Don't Go Breaking My Heart 2,Johnnie To,"Hong Kong, China",2014,"Comedies, International Movies, Romantic Movies"
s4340,Movie,Faraar,Baljit Singh Deo,Australia,2015,"Action & Adventure, Dramas, International Movies"
s4341,TV Show,Haunted House,Unknown,Unknown,2017,"Kids' TV, Korean TV Shows"
s4342,Movie,Helios,"Leung Lok Man, Luk Kim-ching","Hong Kong, China, United States",2015,"Action & Adventure, International Movies"
s4343,Movie,Line Walker,Jazz Boon,"China, Hong Kong",2016,"Action & Adventure, Dramas, International Movies"
s4344,Movie,Look for a Star,Andrew Lau Wai-Keung,Hong Kong,2009,"Comedies, International Movies, Romantic Movies"
s4345,Movie,Oddbods: The Festive Menace,Unknown,Unknown,2018,Movies
s4346,Movie,Once a Gangster,Felix Chong,Hong Kong,2010,"Action & Adventure, Comedies, International Movies"
s4347,Movie,Power Paandi,Dhanush,India,2017,"Dramas, Independent Movies, International Movies"
s4348,Movie,Roll With Me,Unknown,United States,2017,"Documentaries, Sports Movies"
s4349,Movie,SDU: Sex Duties Unit,Gary Mak,Hong Kong,2013,"Comedies, International Movies"
s4350,Movie,Set Off,Liu Jiang,China,2008,"Dramas, International Movies"
s4351,TV Show,1983,Unknown,"Poland, United States",2018,"Crime TV Shows, International TV Shows, TV Dramas"
s4352,Movie,A Christmas Prince: The Royal Wedding,John Schultz,United States,2018,"Children & Family Movies, Dramas, Romantic Movies"
s4353,Movie,Angela's Christmas,Damien O’Connor,"Ireland, Canada",2018,Children & Family Movies
s4354,TV Show,Death by Magic,Unknown,United States,2018,Reality TV
s4355,Movie,El club de los insomnes,"Joseduardo Giordano, Sergio Goyri Jr.",Mexico,2018,"Dramas, International Movies"
s4356,Movie,Happy as Lazzaro,Alice Rohrwacher,"Italy, Switzerland, France, Germany",2018,"Dramas, Independent Movies, International Movies"
s4357,TV Show,Love and Fortune,Unknown,Japan,2018,"International TV Shows, Romantic TV Shows, TV Dramas"
s4358,Movie,Manto,Nandita Das,India,2018,"Dramas, Independent Movies, International Movies"
s4359,Movie,Rajma Chawal,Leena Yadav,India,2018,"Comedies, Dramas, International Movies"
s4360,TV Show,Spy Kids: Mission Critical,Unknown,"United States, Canada",2018,Kids' TV
s4361,Movie,The World Is Yours,Romain Gavras,France,2018,"Action & Adventure, Comedies, International Movies"
s4362,Movie,Time Share,Sebastián Hofmann,"Mexico, Netherlands",2018,"Dramas, Independent Movies, International Movies"
s4363,TV Show,Bumping Mics with Jeff Ross & Dave Attell,Unknown,United States,2018,"Stand-Up Comedy & Talk Shows, TV Comedies"
s4364,TV Show,Minecraft: Story Mode,Unknown,"United States, Sweden",2015,Kids' TV
s4365,Movie,My Little Pony Friendship Is Magic: Best Gift Ever,"Denny Lu, Mike Myhre",United States,2018,Children & Family Movies
s4366,TV Show,Frontier,Unknown,Canada,2018,"International TV Shows, TV Action & Adventure, TV Dramas"
s4367,TV Show,Fugitiva,Unknown,Spain,2018,"Crime TV Shows, International TV Shows, Spanish-Language TV Shows"
s4368,TV Show,Sick Note,Unknown,United Kingdom,2018,"British TV Shows, International TV Shows, TV Comedies"
s4369,TV Show,Mystery Science Theater 3000: The Return,Unknown,United States,2018,"TV Comedies, TV Sci-Fi & Fantasy"
s4370,Movie,The Christmas Chronicles,Clay Kaytis,United States,2018,"Children & Family Movies, Comedies"
s4371,Movie,The Tribe,Fernando Colomo,Spain,2018,"Comedies, International Movies"
s4372,TV Show,Kulipari: Dream Walker,Unknown,Unknown,2018,Kids' TV
s4373,TV Show,Paap-O-Meter,Unknown,Unknown,2017,"Kids' TV, TV Comedies"
s4374,Movie,Puppy Star Christmas,Robert Vince,"United States, Canada",2018,"Children & Family Movies, Comedies"
s4375,Movie,Sabrina,Rocky Soraya,Indonesia,2018,"Horror Movies, International Movies"
s4376,Movie,Target,Raditya Dika,Indonesia,2018,"Comedies, Horror Movies, International Movies"
s4377,TV Show,The Final Table,Unknown,United States,2018,Reality TV
s4378,Movie,Trevor Noah: Son of Patricia,David Paul Meyer,United States,2018,Stand-Up Comedy
s4379,Movie,The Pixar Story,Leslie Iwerks,United States,2007,Documentaries
s4380,TV Show,Eternal Love,Unknown,China,2017,"International TV Shows, Romantic TV Shows, TV Dramas"
s4381,TV Show,La Doña,Unknown,"United States, Mexico",2016,"Spanish-Language TV Shows, TV Dramas"
s4382,TV Show,Silvana Sin Lana,Unknown,United States,2016,"Romantic TV Shows, Spanish-Language TV Shows, TV Comedies"
s4383,Movie,Cam,Daniel Goldhaber,United States,2018,"Horror Movies, Independent Movies, Thrillers"
s4384,Movie,Nothing to Hide,Fred Cavayé,"France, Belgium",2018,"Comedies, Dramas, International Movies"
s4385,TV Show,Ponysitters Club,Unknown,Canada,2018,"Kids' TV, TV Dramas"
s4386,Movie,The Ballad of Buster Scruggs,"Joel Coen, Ethan Coen",United States,2018,"Comedies, Dramas"
s4387,Movie,The Princess Switch,Unknown,United States,2018,"Children & Family Movies, Dramas, Romantic Movies"
s4388,TV Show,Vai Anitta,Unknown,Brazil,2018,"Docuseries, International TV Shows, Reality TV"
s4389,Movie,Aalorukkam,V C Abhilash,India,2018,"Dramas, Independent Movies, International Movies"
s4390,TV Show,Beyblade Burst Evolution,Unknown,Unknown,2017,"Anime Series, Kids' TV"
s4391,Movie,Christmas Wedding Planner,Justin G. Dyck,Canada,2017,"Comedies, International Movies, Romantic Movies"
s4392,Movie,Halkaa,Nila Madhab Panda,India,2018,"Comedies, Dramas, Independent Movies"
s4393,Movie,May the Devil Take You,Timo Tjahjanto,Indonesia,2018,"Horror Movies, International Movies"
s4394,Movie,Muzaffarnagar Baaqi Hai,Nakul Singh Sawhney,India,2015,"Documentaries, International Movies"
s4395,Movie,Odu Raja Odu,"Nishanth Ravindaran, Jathin Sanker Raj",India,2018,"Comedies, Independent Movies, International Movies"
s4396,Movie,Savita Damodar Paranjpe,Swapna Waghmare Joshi,India,2018,"Horror Movies, International Movies"
s4397,Movie,The Giant,"Aitor Arregi, Jon Garaño",Spain,2017,"Dramas, International Movies"
s4398,Movie,BuyBust,Erik Matti,Philippines,2018,"Action & Adventure, International Movies"
s4399,Movie,Loudon Wainwright III: Surviving Twin,Christopher Guest,Unknown,2018,Music & Musicals
s4400,TV Show,Warrior,Unknown,Denmark,2018,"Crime TV Shows, International TV Shows, TV Dramas"
s4401,TV Show,Age of Tanks,Unknown,"Germany, France, Russia",2017,"Docuseries, International TV Shows, Science & Nature TV"
s4402,Movie,"All's Well, End's Well (2009)",Vincent Kok,Hong Kong,2009,"Comedies, International Movies, Romantic Movies"
s4403,Movie,Lommbock,Christian Zübert,Germany,2017,"Comedies, International Movies"
s4404,TV Show,Medal of Honor,Unknown,United States,2018,"Docuseries, TV Dramas"
s4405,Movie,Outlaw King,David Mackenzie,"United Kingdom, United States",2018,"Action & Adventure, Dramas"
s4406,TV Show,Super Drags,Unknown,Brazil,2018,"International TV Shows, TV Comedies"
s4407,TV Show,The Queen of Flow,Unknown,Colombia,2018,"Crime TV Shows, International TV Shows, Spanish-Language TV Shows"
s4408,TV Show,Treehouse Detectives,Unknown,"South Korea, United States",2018,"Kids' TV, TV Thrillers"
s4409,TV Show,Westside,Unknown,United States,2018,Reality TV
s4410,TV Show,Transfers,Unknown,"France, Belgium",2017,"Crime TV Shows, International TV Shows, TV Sci-Fi & Fantasy"
s4411,TV Show,Damnation,Unknown,United States,2017,"Crime TV Shows, TV Dramas"
s4412,Movie,Bucket List,Tejas Prabha Vijay Deoskar,India,2018,"Dramas, International Movies"
s4413,Movie,John Leguizamo's Latin History for Morons,Unknown,United States,2018,Stand-Up Comedy
s4414,TV Show,Kopitiam,Unknown,Malaysia,2003,"International TV Shows, TV Comedies"
s4415,Movie,Ana e Vitória,Matheus Souza,Brazil,2018,"Comedies, International Movies, LGBTQ Movies"
s4416,TV Show,Brainchild,Unknown,Unknown,2018,Kids' TV
s4417,Movie,ReMastered: Tricky Dick & The Man in Black,Sara Dosa,United States,2018,"Documentaries, Music & Musicals"
s4418,Movie,The Holiday Calendar,Bradley Walsh,United States,2018,"Dramas, Romantic Movies"
s4419,Movie,The Other Side of the Wind,Orson Welles,"France, Iran, United States",2018,"Classic Movies, Dramas, Independent Movies"
s4420,Movie,They’ll Love Me When I’m Dead,Morgan Neville,United States,2018,Documentaries
