show_id,type,title,director,country,release_year,listed_in
s6524,Movie,Compulsion,Craig Goodwill,"United Kingdom, Canada, Italy",2016,"Dramas, Thrillers"
s6525,TV Show,Conan Without Borders,Unknown,United States,2018,"Docuseries, TV Comedies"
s6526,Movie,Concrete Football,"Jesse Adang, Syrine Boulanouar","Czech Republic, France",2016,"Documentaries, International Movies, Sports Movies"
s6527,Movie,Concussion,Stacie Passon,United States,2013,"Dramas, Independent Movies, LGBTQ Movies"
s6528,Movie,Conjuring Spirit,Van M. Pham,Vietnam,2014,"Horror Movies, International Movies, Thrillers"
s6529,Movie,Conor McGregor: Notorious,Gavin Fitzgerald,Ireland,2017,"Documentaries, Sports Movies"
s6530,Movie,Consequences ,Ozan Açıktan,Turkey,2014,"Dramas, International Movies, Thrillers"
s6531,Movie,Contract,Ram Gopal Varma,India,2008,"Action & Adventure, Dramas, Independent Movies"
s6532,Movie,Convict,Abdul Aziz Hashad,Unknown,2014,"Dramas, International Movies"
s6533,TV Show,Cooking on High,Unknown,United States,2018,Reality TV
s6534,Movie,Cool Hand Luke,Stuart Rosenberg,United States,1967,"Classic Movies, Dramas"
s6535,Movie,Cop and a Half: New Recruit,Jon Rosenbaum,Canada,2017,"Children & Family Movies, Comedies"
s6536,Movie,Cop Watchers,Ben Steele,Unknown,2016,"Documentaries, International Movies"
s6537,Movie,Coraline,Henry Selick,United States,2009,Children & Family Movies
s6538,Movie,Counterfeiting in Suburbia,Jason Bourque,Canada,2018,"Dramas, Thrillers"
s6539,TV Show,Court Justice,Unknown,Australia,2017,"Crime TV Shows, Docuseries, International TV Shows"
s6540,Movie,Covered: Alive in Asia,"Micah Bickham, Galley Molina",United States,2016,"Documentaries, Faith & Spirituality, Music & Musicals"
s6541,Movie,Crash,Paul Haggis,"United States, Germany",2004,"Dramas, Independent Movies"
s6542,Movie,CRD,Kranti Kanade,India,2016,"Comedies, Dramas, Independent Movies"
s6543,TV Show,Crime Time,Unknown,France,2017,"Crime TV Shows, International TV Shows, TV Action & Adventure"
s6544,Movie,"Crouching Tiger, Hidden Dragon",Ang Lee,"Taiwan, Hong Kong, United States, China",2000,"Action & Adventure, International Movies, Romantic Movies"
s6545,Movie,Cult of Chucky,Don Mancini,United States,2017,Horror Movies
s6546,Movie,Cutie and the Boxer,Zachary Heinzerling,United States,2013,Documentaries
s6547,Movie,Daagdi Chaawl,Chandrakant Kanse,India,2015,"Action & Adventure, Dramas, International Movies"
s6548,Movie,Dabbe 6: The Return,Hasan Karacadağ,Turkey,2015,"Horror Movies, International Movies"
s6549,Movie,Dad,Gary David Goldberg,United States,1989,Dramas
s6550,TV Show,Dad's Army,Unknown,United Kingdom,1977,"British TV Shows, Classic & Cult TV, TV Comedies"
s6551,Movie,Daddy Day Care,Steve Carr,United States,2003,"Children & Family Movies, Comedies"
s6552,Movie,Daddy Issues,Amara Cash,United States,2019,"Dramas, Independent Movies, LGBTQ Movies"
s6553,Movie,Daemonium,Pablo Parés,Argentina,2015,"Action & Adventure, Horror Movies, International Movies"
s6554,Movie,Daffedar,Johnson Esthappan,India,2017,"Dramas, International Movies"
s6555,Movie,Dagh Ujala,Raj Amit Kumar,"United States, India",2015,"Dramas, Independent Movies, International Movies"
s6556,Movie,Dallas Buyers Club,Jean-Marc Vallée,United States,2013,"Dramas, Independent Movies, LGBTQ Movies"
s6557,TV Show,Dance Academy,Unknown,Australia,2013,"International TV Shows, Romantic TV Shows, TV Dramas"
s6558,Movie,Dance Academy: The Comeback,Jeffrey Walker,"Germany, Australia",2017,"Dramas, International Movies"
s6559,Movie,Dancing Quietly,Philipp Eichholtz,Germany,2016,"Dramas, Independent Movies, International Movies"
s6560,TV Show,Dandy,Unknown,Mexico,2016,"Crime TV Shows, International TV Shows, Spanish-Language TV Shows"
s6561,TV Show,Dangerous Roads,Unknown,United Kingdom,2012,"British TV Shows, Docuseries"
s6562,Movie,Danny Says,Brendan Toller,United States,2015,"Documentaries, Music & Musicals"
s6563,Movie,Dante's Peak,Roger Donaldson,United States,1997,Action & Adventure
s6564,Movie,Dare to Be Wild,Unknown,Ireland,2015,"Dramas, Independent Movies, Romantic Movies"
s6565,Movie,Dark Chocolate (Bengali Version),Agnidev Chatterjee,India,2016,"Dramas, International Movies, Thrillers"
s6566,Movie,Dark Crimes,Alexandros Avranas,"United Kingdom, Poland, United States",2016,"Dramas, Thrillers"
s6567,Movie,Dark Places,Gilles Paquet-Brenner,"United States, United Kingdom, France",2015,"Dramas, International Movies, Thrillers"
s6568,Movie,Darna Mana Hai,Prawal Raman,India,2003,"Horror Movies, International Movies, Thrillers"
s6569,TV Show,Darr Sabko Lagta Hai,Unknown,India,2015,"International TV Shows, TV Horror, TV Thrillers"
s6570,Movie,Darra,Parveen Kumar,India,2016,"Dramas, International Movies"
s6571,Movie,Daughters of the Dust,Julie Dash,"United Kingdom, United States",1991,"Classic Movies, Dramas, Independent Movies"
s6572,TV Show,Day and Night,Unknown,China,2017,"Crime TV Shows, International TV Shows, TV Dramas"
s6573,TV Show,Days We Stared at the Sun,Unknown,Taiwan,2017,"International TV Shows, TV Dramas"
s6574,Movie,Dayveon,Amman Abbasi,United States,2017,"Dramas, Independent Movies"
s6575,Movie,De Film van Dylan Haegens,"Dylan Haegens, Bas van Teylingen",Netherlands,2018,"Comedies, International Movies"
s6576,Movie,De Palma,"Noah Baumbach, Jake Paltrow",United States,2015,Documentaries
s6577,Movie,Dead in a Week (Or Your Money Back),Tom Edmunds,United Kingdom,2018,Comedies
s6578,Movie,Deadline: Sirf 24 Ghante,Tanveer Khan,India,2006,"Independent Movies, International Movies, Thrillers"
s6579,Movie,Deadly Scholars,Danny J. Boyle,United States,2018,"Dramas, Thrillers"
s6580,Movie,Dean,Demetri Martin,United States,2016,"Comedies, Dramas, Independent Movies"
s6581,Movie,Dear Dad,Tanuj Bhramar,India,2016,"Comedies, Dramas, Independent Movies"
s6582,Movie,Dear Dracula,Chad Van De Keere,United States,2012,"Children & Family Movies, Comedies"
s6583,Movie,Dear Santa,Jason Priestley,Canada,2011,"Comedies, Romantic Movies"
s6584,Movie,Death at a Funeral,Neil LaBute,United States,2010,Comedies
s6585,Movie,Death House,Harrison Smith,United States,2017,Horror Movies
s6586,Movie,Deathgrip,Clay Porter,United Kingdom,2017,"International Movies, Sports Movies"
s6587,TV Show,Deep Undercover Collection,Unknown,United States,2017,"Crime TV Shows, Docuseries"
s6588,TV Show,Deep Water,Unknown,Australia,2016,"Crime TV Shows, International TV Shows, TV Dramas"
s6589,Movie,Deewangee,Anees Bazmee,India,2002,"International Movies, Thrillers"
s6590,Movie,Defying the Nazis: The Sharps' War,"Ken Burns, Artemis Joukowsky",United States,2016,Documentaries
s6591,Movie,Delirium,Dennis Iliadis,United States,2018,"Horror Movies, Thrillers"
s6592,Movie,Democrats,Camilla Nielsson,"Denmark, Zimbabwe",2014,"Documentaries, International Movies"
s6593,Movie,Den of Thieves,Christian Gudegast,United States,2018,Action & Adventure
s6594,Movie,Denis Leary: No Cure For Cancer,Ted Demme,United States,1992,Stand-Up Comedy
s6595,Movie,Desolate,Frederick Cipoletti,Unknown,2018,"Dramas, Thrillers"
s6596,Movie,Desolation,Sam Patton,United States,2017,"Horror Movies, Thrillers"
s6597,Movie,Detention Letter,Mohamed Samy,Egypt,2017,"Action & Adventure, International Movies"
s6598,Movie,Detour,Christopher Smith,"United Kingdom, South Africa",2016,Thrillers
s6599,Movie,Deviant Love,Michael Feifer,United States,2019,Thrillers
s6600,Movie,Devil's Bride,Saara Cantell,"Finland, Sweden, Norway, Latvia, Germany",2016,"Dramas, International Movies"
s6601,Movie,Devil's Gate,Clay Staub,Canada,2017,"Horror Movies, Sci-Fi & Fantasy, Thrillers"
s6602,TV Show,Devlok with Devdutt Pattanaik,Unknown,India,2017,International TV Shows
s6603,Movie,Devrai,"Sumitra Bhave, Sunil Sukthankar",India,2004,"Dramas, International Movies"
s6604,TV Show,Dexter,Unknown,United States,2013,"Crime TV Shows, TV Dramas, TV Mysteries"
s6605,Movie,Dhamaal,Indra Kumar,India,2007,"Action & Adventure, Comedies, International Movies"
s6606,Movie,Di Renjie zhi Sidatianwang,Hark Tsui,"China, Hong Kong",2018,"Action & Adventure, International Movies, Sci-Fi & Fantasy"
s6607,Movie,Diana: 7 Days That Shook the World,Ben Ryder,United Kingdom,2017,Documentaries
s6608,Movie,Diana: In Her Own Words,Unknown,United Kingdom,2017,"Documentaries, International Movies"
s6609,Movie,Diary of a Chambermaid,Benoît Jacquot,"France, Belgium",2015,"Dramas, International Movies"
s6610,Movie,Die Another Day,Lee Tamahori,"United Kingdom, United States",2002,Action & Adventure
s6611,Movie,Dil Hai Tumhaara,Kundan Shah,India,2002,"Dramas, International Movies, Music & Musicals"
s6612,TV Show,Dinner for Five,Unknown,United States,2007,Stand-Up Comedy & Talk Shows
s6613,Movie,Dinner for Schmucks,Jay Roach,United States,2010,Comedies
s6614,TV Show,Dino Hunt,Unknown,Canada,2016,"Docuseries, Science & Nature TV"
s6615,Movie,Disciples Of The 36th Chamber,Chia-Liang Liu,Hong Kong,1985,"Action & Adventure, International Movies"
s6616,Movie,Discovering Bigfoot,Todd Standing,United States,2017,Documentaries
s6617,Movie,Dismissed,Benjamin Arfmann,United States,2017,Thrillers
s6618,Movie,District 9,Neill Blomkamp,"South Africa, United States, New Zealand, Canada",2009,"Action & Adventure, International Movies, Sci-Fi & Fantasy"
s6619,TV Show,Diva Brides,Unknown,Unknown,2017,"British TV Shows, Reality TV"
s6620,Movie,Doctor Zhivago,David Lean,"United States, Italy, United Kingdom, Liechtenstein",1965,"Classic Movies, Dramas, Romantic Movies"
s6621,Movie,Dog Eat Dog,Paul Schrader,United States,2016,"Dramas, Thrillers"
s6622,Movie,Dolphin Kick,Philip Marlatt,United States,2019,Children & Family Movies
s6623,Movie,Dolphin Tale 2,Charles Martin Smith,United States,2014,"Children & Family Movies, Dramas"
s6624,Movie,Domino,Brian De Palma,"Denmark, France, Belgium, Italy, Netherlands, United States, United Kingdom",2019,"International Movies, Thrillers"
s6625,Movie,Don Quixote: The Ingenious Gentleman of La Mancha,"Mahin Ibrahim, Austin Kolodney, Will Lowell, David Beier, Dave Dorsey, Xu Zhang, Alana Waksman, Jon YonKondy, Drue Metz, Brandon Somerhalder",United States,2015,"Comedies, Independent Movies"
s6626,Movie,Don Verdean,Jared Hess,United States,2015,Comedies
s6627,Movie,Don't Be Afraid of the Dark,Troy Nixey,"United States, Australia, Mexico",2010,Horror Movies
s6628,Movie,Don't Crack Under Pressure,Thierry Donard,France,2015,"Action & Adventure, Documentaries, International Movies"
s6629,Movie,Don't Crack Under Pressure II,Thierry Donard,France,2016,"Action & Adventure, Documentaries, International Movies"
s6630,Movie,Don't Crack Under Pressure III,Thierry Donard,France,2017,"Action & Adventure, Documentaries, International Movies"
s6631,Movie,Don't Knock Twice,Caradog W. James,United Kingdom,2016,"Horror Movies, International Movies"
s6632,Movie,Don't Look Down,Daniel Gordon,United Kingdom,2016,"Documentaries, International Movies"
s6633,Movie,Don't Think Twice,Mike Birbiglia,United States,2016,"Comedies, Dramas, Independent Movies"
s6634,Movie,Donnie Brasco,Mike Newell,United States,1997,"Dramas, Thrillers"
s6635,Movie,Doom,Andrzej Bartkowiak,"United Kingdom, Czech Republic, Germany, United States",2005,"Action & Adventure, Horror Movies, Sci-Fi & Fantasy"
s6636,TV Show,Doomsday Preppers,Unknown,United States,2013,"Reality TV, Science & Nature TV"
s6637,Movie,Doubles Cause Troubles,Wong Jing,Hong Kong,1989,"Action & Adventure, Comedies, International Movies"
s6638,Movie,Doubt,John Patrick Shanley,United States,2008,"Dramas, Faith & Spirituality"
s6639,Movie,Down The Fence,M.J. Isakson,United States,2017,Documentaries
s6640,Movie,Dr. Seuss' The Cat in the Hat,Bo Welch,United States,2003,"Children & Family Movies, Comedies"
s6641,Movie,Dr. Seuss' The Grinch,"Scott Mosier, Yarrow Cheney","France, China, Japan, United States",2018,"Children & Family Movies, Comedies"
s6642,Movie,Dragonheart,Rob Cohen,United States,1996,"Action & Adventure, Sci-Fi & Fantasy"
s6643,Movie,Dragonheart 3: The Sorcerer,Colin Teague,United States,2015,"Action & Adventure, Sci-Fi & Fantasy"
s6644,Movie,Dragonheart: A New Beginning,Doug Lefler,United States,2000,"Action & Adventure, Sci-Fi & Fantasy"
s6645,Movie,Dragonheart: Battle for the Heartfire,Patrik Syversen,United States,2017,"Action & Adventure, Sci-Fi & Fantasy"
s6646,Movie,Dragonkala Ka Rahasya,Rajiv Chilaka,Unknown,2018,Children & Family Movies
s6647,TV Show,Dramaworld,Unknown,"United States, South Korea, China",2016,"Romantic TV Shows, TV Comedies, TV Dramas"
s6648,Movie,Dream Big: Engineering Our World,Greg MacGillivray,United States,2017,Documentaries
s6649,Movie,Dream Boat,Tristan Ferland Milewski,Germany,2017,"Documentaries, International Movies, LGBTQ Movies"
s6650,Movie,Dries,Reiner Holzemer,"Germany, Belgium",2017,"Documentaries, International Movies"
s6651,Movie,Driven to Dance,Unknown,United States,2018,Dramas
s6652,TV Show,"Drugs, Inc.",Unknown,United States,2015,"Crime TV Shows, Docuseries"
s6653,TV Show,Dueños del paraíso,Unknown,"United States, Chile",2015,"Crime TV Shows, International TV Shows, Spanish-Language TV Shows"
s6654,Movie,Dukhtar,Afia Nathaniel,"Pakistan, Norway, United States",2014,"Dramas, Independent Movies, International Movies"
s6655,Movie,Dum,Eeshwar Nivas,India,2003,"Action & Adventure, Dramas, International Movies"
s6656,Movie,Dumb and Dumberer: When Harry Met Lloyd,Troy Miller,United States,2003,Comedies
s6657,Movie,E-Cigarettes: Miracle or Menace?,Emma Hatherley,United Kingdom,2016,Documentaries
s6658,Movie,Earth to Echo,Dave Green,United States,2014,"Children & Family Movies, Sci-Fi & Fantasy"
s6659,TV Show,Earth to Luna!,Unknown,Brazil,2014,Kids' TV
s6660,TV Show,Earth's Natural Wonders,Unknown,United Kingdom,2015,"British TV Shows, Docuseries, Science & Nature TV"
s6661,TV Show,Earth's Natural Wonders: Life at the Extremes,Unknown,Unknown,2018,"British TV Shows, Docuseries, Science & Nature TV"
s6662,Movie,East Side Sushi,Anthony Lucero,United States,2015,Dramas
s6663,Movie,Easy A,Will Gluck,United States,2010,"Comedies, Romantic Movies"
s6664,TV Show,Easy Fortune Happy Life,Unknown,Taiwan,2009,"International TV Shows, Romantic TV Shows, TV Comedies"
s6665,Movie,Eat Pray Love,Ryan Murphy,United States,2010,"Dramas, Romantic Movies"
s6666,Movie,Eddie Murphy: Delirious,Bruce Gowers,United States,1983,Stand-Up Comedy
s6667,Movie,Eeda,Ajithkumar,India,2018,"Dramas, International Movies, Romantic Movies"
s6668,Movie,Eh Janam Tumhare Lekhe,Harjit Singh,India,2015,"Dramas, International Movies"
s6669,Movie,Ek Cup Chya,"Sumitra Bhave, Sunil Sukthankar",India,2009,"Dramas, Independent Movies, International Movies"
s6670,Movie,Ek Hasina Thi,Sriram Raghavan,India,2004,"Dramas, International Movies, Thrillers"
s6671,Movie,El último testigo,Philipp Stölzl,"United States, Canada, Belgium, United Kingdom",2012,Action & Adventure
s6672,TV Show,El Barco,Unknown,Spain,2013,"International TV Shows, Romantic TV Shows, Spanish-Language TV Shows"
s6673,TV Show,El Cartel,Unknown,Colombia,2008,"Crime TV Shows, International TV Shows, Spanish-Language TV Shows"
s6674,TV Show,El Cartel 2,Unknown,Colombia,2010,"Crime TV Shows, International TV Shows, Spanish-Language TV Shows"
s6675,TV Show,El Chavo,Unknown,Mexico,1979,"Classic & Cult TV, Kids' TV, Spanish-Language TV Shows"
s6676,Movie,El Che,Matías Gueilburt,Venezuela,2017,"Documentaries, International Movies"
s6677,TV Show,El Clon,Unknown,United States,2010,"Romantic TV Shows, Spanish-Language TV Shows, TV Dramas"
s6678,Movie,El fin de ETA,Justin Webster,Spain,2017,"Documentaries, International Movies"
s6679,TV Show,El Vato,Unknown,United States,2017,"International TV Shows, Spanish-Language TV Shows, TV Comedies"
s6680,Movie,El Viaje: Márama y Rombai,Federico Lemos,Unknown,2016,"Children & Family Movies, Documentaries, International Movies"
s6681,Movie,Elephants Dream 4 Hour,Bassam Kurdali,Netherlands,2006,"International Movies, Sci-Fi & Fantasy"
s6682,Movie,Elizabeth at 90: A Family Tribute,John Bridcut,United Kingdom,2016,Documentaries
s6683,Movie,Elizabeth Harvest,Sebastian Gutierrez,United States,2019,"Dramas, Sci-Fi & Fantasy"
s6684,Movie,Elles étaient en guerre (1914-1918),"Fabien Beziat, Hugues Nancy",France,2014,"Documentaries, International Movies"
s6685,Movie,Elles étaient en guerre 1939-1945,"Hugues Nancy, Fabien Beziat",Unknown,2015,"Documentaries, International Movies"
s6686,Movie,Elles ont toutes une histoire,Nils Tavernier,Unknown,2016,"Documentaries, International Movies"
s6687,Movie,Elstree 1976,Jon Spira,United Kingdom,2015,Documentaries
s6688,Movie,Emelie,Michael Thelin,United States,2016,"Horror Movies, Thrillers"
s6689,Movie,Emma' (Mother),Riri Riza,Indonesia,2016,"Dramas, International Movies"
s6690,Movie,Emo the Musical,Neil Triffett,Australia,2016,"Dramas, International Movies, Music & Musicals"
s6691,TV Show,Emogenius,Unknown,United States,2017,Reality TV
s6692,Movie,Empire of Scents,Kim Nguyen,"Canada, France, Italy, Morocco, United States",2014,"Documentaries, International Movies"
s6693,Movie,Employee of the Month,Greg Coolidge,United States,2006,"Comedies, Romantic Movies"
s6694,TV Show,Encerrados,Unknown,Unknown,2018,"International TV Shows, Spanish-Language TV Shows, TV Comedies"
s6695,Movie,Encounter: The Killing,Ajay Phansekar,India,2002,"Dramas, Independent Movies, International Movies"
s6696,TV Show,Encounters with Evil,Unknown,United Kingdom,2016,"British TV Shows, Crime TV Shows, Docuseries"
s6697,Movie,End of Watch,David Ayer,United States,2012,Action & Adventure
s6698,TV Show,Enemigo íntimo,Unknown,Unknown,2018,"Crime TV Shows, Spanish-Language TV Shows, TV Dramas"
s6699,Movie,Enemy,Denis Villeneuve,"Canada, Spain, France",2013,"Independent Movies, Thrillers"
s6700,Movie,Enlighten Us,Jenny Carchman,United States,2016,Documentaries
s6701,Movie,Entanglement,Jason James,Canada,2018,"Dramas, Independent Movies, Romantic Movies"
s6702,Movie,Enter the Dragon,Robert Clouse,"Hong Kong, United States",1973,"Action & Adventure, Classic Movies"
s6703,Movie,Equals,Drake Doremus,"United States, Indonesia",2015,"Dramas, Romantic Movies, Sci-Fi & Fantasy"
s6704,Movie,Equilibrium,Kurt Wimmer,United States,2002,"Action & Adventure, Dramas, Sci-Fi & Fantasy"
s6705,Movie,"Escape from the ""Liberty"" Cinema",Wojciech Marczewski,Poland,1990,"Comedies, Dramas, Independent Movies"
s6706,Movie,Esperando La Carroza,Alejandro Doria,Argentina,1985,"Comedies, Cult Movies, International Movies"
s6707,Movie,Estar o no estar,Marcelo González,Mexico,2016,"Dramas, International Movies, Romantic Movies"
s6708,Movie,Ethirmarai,Unknown,India,2018,"International Movies, Music & Musicals, Thrillers"
s6709,Movie,Euphoria,Valeria Golino,Italy,2018,"Dramas, International Movies, LGBTQ Movies"
s6710,TV Show,Eurovision Song Contest,Unknown,Unknown,2019,International TV Shows
s6711,Movie,Evan Almighty,Tom Shadyac,United States,2007,"Children & Family Movies, Comedies, Faith & Spirituality"
s6712,Movie,Event Horizon,Paul W.S. Anderson,"United Kingdom, United States",1997,"Horror Movies, Sci-Fi & Fantasy"
s6713,Movie,Every Time I Die,Robi Michael,United States,2019,"Dramas, Independent Movies, Thrillers"
s6714,Movie,Everybody Knows,Asghar Farhadi,"Spain, France, Italy",2019,"Dramas, International Movies, Thrillers"
s6715,TV Show,Everyday Miracles,Unknown,United Kingdom,2014,"British TV Shows, Docuseries, International TV Shows"
s6716,Movie,Evolution,Ivan Reitman,United States,2001,"Comedies, Sci-Fi & Fantasy"
s6717,Movie,Ex Machina,Alex Garland,United Kingdom,2015,"Dramas, Independent Movies, International Movies"
s6718,TV Show,Ex-Boyfriend,Unknown,China,2011,"International TV Shows, Romantic TV Shows, TV Comedies"
s6719,TV Show,Exclusive Edition,James Lee,Unknown,2008,"International TV Shows, TV Dramas"
s6720,Movie,Executive Decision,Stuart Baird,United States,1996,Action & Adventure
s6721,Movie,Exit Afghanistan,"Anders Sømme Hammer, Marius Arnesen, Klaus Erik Okstad, Olav Njaastad",Norway,2013,"Documentaries, International Movies"
s6722,Movie,Exit Strategy,Michael Whitton,United States,2012,"Comedies, Romantic Movies"
s6723,Movie,Exit Wounds,Andrzej Bartkowiak,United States,2001,Action & Adventure
s6724,Movie,Expo,Joseph Mbah,United States,2019,"Action & Adventure, Dramas, Independent Movies"
s6725,TV Show,Extras,Unknown,"United Kingdom, United States",2006,"British TV Shows, TV Comedies"
s6726,Movie,Eyyvah Eyyvah,Hakan Algül,Turkey,2010,"Comedies, International Movies"
s6727,Movie,Eyyvah Eyyvah 2,Hakan Algül,Turkey,2011,"Comedies, International Movies, Romantic Movies"
s6728,Movie,Eyyvah Eyyvah 3,Hakan Algül,Turkey,2014,"Comedies, International Movies"
s6729,TV Show,Ezel,Unknown,Turkey,2009,"Crime TV Shows, International TV Shows, TV Dramas"
s6730,Movie,F the Prom,Benny Fine,United States,2017,"Comedies, Romantic Movies"
s6731,Movie,Face 2 Face,Matt Toronto,United States,2017,"Dramas, Independent Movies"
s6732,TV Show,Fairy Tail,Unknown,Japan,2009,"Anime Series, International TV Shows"
s6733,TV Show,Fake or Fortune?,Unknown,United Kingdom,2015,"British TV Shows, Crime TV Shows, Docuseries"
s6734,Movie,Fakta Ladh Mhana,Sanjay Jadhav,India,2011,"Action & Adventure, Dramas, International Movies"
s6735,Movie,Fall Girls,Chris Stokes,United States,2019,Comedies
s6736,Movie,Fallen,Gregory Hoblit,United States,1998,Thrillers
s6737,Movie,Familiye,"Sedat Kirtan, Kubilay Sarikaya",Germany,2017,"Dramas, Independent Movies, International Movies"
s6738,Movie,Famous in Ahmedabad,Hardik Mehta,India,2015,"Documentaries, International Movies"
s6739,Movie,Fanatic,Keith L. Smith,United States,2019,Thrillers
s6740,Movie,Fandry,Nagraj Manjule,India,2014,"Dramas, Independent Movies, International Movies"
s6741,Movie,Farce,Shadi Ali,Egypt,2017,"Comedies, International Movies"
s6742,TV Show,Fatal Destiny,Unknown,Unknown,2016,"Crime TV Shows, International TV Shows, TV Action & Adventure"
s6743,TV Show,Father Brown,Ian Barber,United Kingdom,2017,"British TV Shows, Crime TV Shows, TV Dramas"
s6744,Movie,Fear and Loathing in Las Vegas,Terry Gilliam,United States,1998,"Comedies, Cult Movies, Dramas"
s6745,TV Show,Fear Files... Har Mod Pe Darr,Unknown,India,2015,"International TV Shows, TV Horror, TV Thrillers"
s6746,Movie,Feel Rich,Peter Spirer,United States,2017,Documentaries
s6747,Movie,Fiddler on the Roof,Norman Jewison,United States,1971,"Classic Movies, Dramas, Music & Musicals"
s6748,Movie,Fifty,Biyi Bandele,Nigeria,2015,"Dramas, International Movies"
s6749,Movie,Figaro Pho,Luke Jurevicius,United Kingdom,2008,"Children & Family Movies, Comedies"
s6750,Movie,Figures of Speech,Ari Levinson,United States,2016,Documentaries
s6751,TV Show,Filinta,Unknown,Turkey,2015,"Crime TV Shows, International TV Shows, TV Action & Adventure"
s6752,Movie,Filmworker,Tony Zierra,United States,2017,Documentaries
s6753,Movie,Filosofi Kopi The Movie,Angga Dwimas Sasongko,Indonesia,2015,"Dramas, International Movies"
s6754,Movie,Final Destination,James Wong,United States,2000,"Cult Movies, Horror Movies, Thrillers"
s6755,Movie,Final Destination 2,David R. Ellis,"United States, Canada",2003,"Horror Movies, Thrillers"
s6756,Movie,Final Destination 3,James Wong,"United States, Germany",2006,Horror Movies
s6757,Movie,Fire at Sea,Gianfranco Rosi,"Italy, France",2016,"Documentaries, International Movies"
s6758,Movie,Fireflies,Sabal Singh Shekawat,India,2013,"Dramas, Independent Movies, International Movies"
s6759,Movie,First Impression,Arthur Muhammad,United States,2018,"Comedies, Romantic Movies"
s6760,Movie,First Kill,Steven C. Miller,"United Kingdom, Canada, United States",2017,Action & Adventure
s6761,Movie,FirstBorn,Nirpal Bhogal,United Kingdom,2016,"Horror Movies, International Movies"
s6762,Movie,Fishpeople,Keith Malloy,Unknown,2017,"Documentaries, Sports Movies"
s6763,Movie,Fishtail,Andrew Renzi,United States,2015,Documentaries
s6764,TV Show,Fit for Fashion,Unknown,Unknown,2015,"International TV Shows, Reality TV"
s6765,Movie,Fittest in Dubai,Gerry Blaksley,United Arab Emirates,2019,"Documentaries, International Movies, Sports Movies"
s6766,Movie,Five Elements Ninjas,Cheh Chang,Hong Kong,1982,"Action & Adventure, International Movies"
s6767,TV Show,Fix It and Finish It,Unknown,United States,2014,Reality TV
s6768,Movie,Flash of Genius,Marc Abraham,"Canada, United States",2008,Dramas
s6769,Movie,Flimflam,Khaled Marei,Egypt,2016,"Comedies, International Movies"
s6770,Movie,Flock of Four,Gregory Caruso,United States,2018,"Dramas, Independent Movies, Music & Musicals"
s6771,TV Show,Flowering Heart,Unknown,South Korea,2016,"Kids' TV, Korean TV Shows"
s6772,Movie,Flying Guillotine 2,"Kang Cheng, Shan Hua",Hong Kong,1978,"Action & Adventure, International Movies"
s6773,Movie,Follow Me,Asri Bendacha,"United Arab Emirates, United States, United Kingdom",2017,"Documentaries, International Movies"
s6774,TV Show,Food: Delicious Science,Unknown,Unknown,2017,"Docuseries, Science & Nature TV"
s6775,TV Show,Footprints in the Sand,Unknown,United States,2011,"International TV Shows, TV Dramas"
s6776,Movie,Footprints: The Path of Your Life,Juan Manuel Cotelo,Spain,2015,"Documentaries, Faith & Spirituality, International Movies"
s6777,Movie,For Colored Girls,Tyler Perry,United States,2010,Dramas
s6778,Movie,For Grace,"Mark Helenowski, Kevin Pang",United States,2015,Documentaries
s6779,Movie,For Greater Glory,Dean Wright,Mexico,2012,"Dramas, International Movies"
s6780,Movie,For Love or Money,Mark Murphy,United Kingdom,2019,Comedies
s6781,Movie,For the Birds,Richard Miron,United States,2018,Documentaries
s6782,Movie,For the Love of Benji,Joe Camp,United States,1977,Children & Family Movies
s6783,TV Show,For the Win,Unknown,United States,2017,Reality TV
s6784,Movie,Forbidden Games: The Justin Fashanu Story,"Jon Carey, Adam Darke",United Kingdom,2017,"Documentaries, International Movies, LGBTQ Movies"
s6785,Movie,Forbidden Planet,Fred M. Wilcox,United States,1956,"Action & Adventure, Classic Movies, Sci-Fi & Fantasy"
s6786,TV Show,Forces of Nature,Unknown,United Kingdom,2016,"British TV Shows, Docuseries, Science & Nature TV"
