show_id,type,title,director,country,release_year,listed_in
s1,Movie,Dick Johnson Is Dead,Kirsten Johnson,United States,2020,Documentaries
s2,TV Show,Blood & Water,Unknown,South Africa,2021,"International TV Shows, TV Dramas, TV Mysteries"
s3,TV Show,Ganglands,Julien Leclercq,Unknown,2021,"Crime TV Shows, International TV Shows, TV Action & Adventure"
s4,TV Show,Jailbirds New Orleans,Unknown,Unknown,2021,"Docuseries, Reality TV"
s5,TV Show,Kota Factory,Unknown,India,2021,"International TV Shows, Romantic TV Shows, TV Comedies"
s6,TV Show,Midnight Mass,Mike Flanagan,Unknown,2021,"TV Dramas, TV Horror, TV Mysteries"
s7,Movie,My Little Pony: A New Generation,"Robert Cullen, José Luis Ucha",Unknown,2021,Children & Family Movies
s8,Movie,Sankofa,Haile Gerima,"United States, Ghana, Burkina Faso, United Kingdom, Germany, Ethiopia",1993,"Dramas, Independent Movies, International Movies"
s9,TV Show,The Great British Baking Show,Andy Devonshire,United Kingdom,2021,"British TV Shows, Reality TV"
s10,Movie,The Starling,Theodore Melfi,United States,2021,"Comedies, Dramas"
s11,TV Show,"Vendetta: Truth, Lies and The Mafia",Unknown,Unknown,2021,"Crime TV Shows, Docuseries, International TV Shows"
s12,TV Show,Bangkok Breaking,Kongkiat Komesiri,Unknown,2021,"Crime TV Shows, International TV Shows, TV Action & Adventure"
s13,Movie,Je Suis Karl,Christian Schwochow,"Germany, Czech Republic",2021,"Dramas, International Movies"
s14,Movie,Confessions of an Invisible Girl,Bruno Garotti,Unknown,2021,"Children & Family Movies, Comedies"
s15,TV Show,Crime Stories: India Detectives,Unknown,Unknown,2021,"British TV Shows, Crime TV Shows, Docuseries"
s16,TV Show,Dear White People,Unknown,United States,2021,"TV Comedies, TV Dramas"
s17,Movie,Europe's Most Dangerous Man: Otto Skorzeny in Spain,"Pedro de Echave García, Pablo Azorín Williams",Unknown,2020,"Documentaries, International Movies"
s18,TV Show,Falsa identidad,Unknown,Mexico,2020,"Crime TV Shows, Spanish-Language TV Shows, TV Dramas"
s19,Movie,Intrusion,Adam Salky,Unknown,2021,Thrillers
s20,TV Show,Jaguar,Unknown,Unknown,2021,"International TV Shows, Spanish-Language TV Shows, TV Action & Adventure"
s21,TV Show,Monsters Inside: The 24 Faces of Billy Milligan,Olivier Megaton,Unknown,2021,"Crime TV Shows, Docuseries, International TV Shows"
s22,TV Show,Resurrection: Ertugrul,Unknown,Turkey,2018,"International TV Shows, TV Action & Adventure, TV Dramas"
s23,Movie,Avvai Shanmughi,K.S. Ravikumar,Unknown,1996,"Comedies, International Movies"
s24,Movie,Go! Go! Cory Carson: Chrissy Takes the Wheel,"Alex Woo, Stanley Moore",Unknown,2021,Children & Family Movies
s25,Movie,Jeans,S. Shankar,India,1998,"Comedies, International Movies, Romantic Movies"
s26,TV Show,Love on the Spectrum,Unknown,Australia,2021,"Docuseries, International TV Shows, Reality TV"
s27,Movie,Minsara Kanavu,Rajiv Menon,Unknown,1997,"Comedies, International Movies, Music & Musicals"
s28,Movie,Grown Ups,Dennis Dugan,United States,2010,Comedies
s29,Movie,Dark Skies,Scott Stewart,United States,2013,"Horror Movies, Sci-Fi & Fantasy"
s30,Movie,Paranoia,Robert Luketic,"United States, India, France",2013,Thrillers
s31,Movie,Ankahi Kahaniya,"Ashwiny Iyer Tiwari, Abhishek Chaubey, Saket Chaudhary",Unknown,2021,"Dramas, Independent Movies, International Movies"
s32,TV Show,Chicago Party Aunt,Unknown,Unknown,2021,TV Comedies
s33,TV Show,Sex Education,Unknown,United Kingdom,2020,"British TV Shows, International TV Shows, TV Comedies"
s34,TV Show,Squid Game,Unknown,Unknown,2021,"International TV Shows, TV Dramas, TV Thrillers"
s35,TV Show,Tayo and Little Wizards,Unknown,Unknown,2020,Kids' TV
s36,Movie,The Father Who Moves Mountains,Daniel Sandu,Unknown,2021,"Dramas, International Movies, Thrillers"
s37,Movie,The Stronghold,Cédric Jimenez,Unknown,2021,"Action & Adventure, Dramas, International Movies"
s38,TV Show,Angry Birds,Unknown,Finland,2018,"Kids' TV, TV Comedies"
s39,Movie,Birth of the Dragon,George Nolfi,"China, Canada, United States",2017,"Action & Adventure, Dramas"
s40,TV Show,Chhota Bheem,Unknown,India,2021,Kids' TV
s41,TV Show,He-Man and the Masters of the Universe,Unknown,United States,2021,"Kids' TV, TV Sci-Fi & Fantasy"
s42,Movie,Jaws,Steven Spielberg,United States,1975,"Action & Adventure, Classic Movies, Dramas"
s43,Movie,Jaws 2,Jeannot Szwarc,United States,1978,"Dramas, Horror Movies, Thrillers"
s44,Movie,Jaws 3,Joe Alves,United States,1983,"Action & Adventure, Horror Movies, Thrillers"
s45,Movie,Jaws: The Revenge,Joseph Sargent,United States,1987,"Action & Adventure, Horror Movies, Thrillers"
s46,Movie,My Heroes Were Cowboys,Tyler Greco,Unknown,2021,Documentaries
s47,Movie,Safe House,Daniel Espinosa,"South Africa, United States, Japan",2012,Action & Adventure
s48,TV Show,The Smart Money Woman,Bunmi Ajakaiye,Unknown,2020,"International TV Shows, Romantic TV Shows, TV Comedies"
s49,Movie,Training Day,Antoine Fuqua,United States,2001,"Dramas, Thrillers"
s50,TV Show,Castle and Castle,Unknown,Nigeria,2021,"International TV Shows, TV Dramas"
s51,TV Show,Dharmakshetra,Unknown,India,2014,"International TV Shows, TV Dramas, TV Sci-Fi & Fantasy"
s52,Movie,InuYasha the Movie 2: The Castle Beyond the Looking Glass,Toshiya Shinohara,Japan,2002,"Action & Adventure, Anime Features, International Movies"
s53,Movie,InuYasha the Movie 3: Swords of an Honorable Ruler,Toshiya Shinohara,Japan,2003,"Action & Adventure, Anime Features, International Movies"
s54,Movie,InuYasha the Movie 4: Fire on the Mystic Island,Toshiya Shinohara,Japan,2004,"Action & Adventure, Anime Features, International Movies"
s55,Movie,InuYasha the Movie: Affections Touching Across Time,Toshiya Shinohara,Japan,2001,"Action & Adventure, Anime Features, International Movies"
s56,TV Show,Nailed It,Unknown,United States,2021,Reality TV
s57,Movie,Naruto Shippuden the Movie: Blood Prison,Masahiko Murata,Japan,2011,"Action & Adventure, Anime Features, International Movies"
s58,Movie,Naruto Shippûden the Movie: Bonds,Hajime Kamegaki,Japan,2008,"Action & Adventure, Anime Features, International Movies"
s59,Movie,Naruto Shippûden the Movie: The Will of Fire,Masahiko Murata,Japan,2009,"Action & Adventure, Anime Features, International Movies"
s60,Movie,Naruto Shippuden: The Movie,Hajime Kamegaki,Japan,2007,"Action & Adventure, Anime Features, International Movies"
s61,Movie,Naruto Shippuden: The Movie: The Lost Tower,Masahiko Murata,Japan,2010,"Action & Adventure, Anime Features, International Movies"
s62,Movie,Naruto the Movie 2: Legend of the Stone of Gelel,Hirotsugu Kawasaki,Japan,2005,"Action & Adventure, Anime Features, International Movies"
s63,Movie,Naruto the Movie 3: Guardians of the Crescent Moon Kingdom,Toshiyuki Tsuru,Japan,2006,"Action & Adventure, Anime Features, International Movies"
s64,Movie,Naruto the Movie: Ninja Clash in the Land of Snow,Tensai Okamura,Japan,2004,"Action & Adventure, Anime Features, International Movies"
s65,Movie,Nightbooks,David Yarovesky,Unknown,2021,Children & Family Movies
s66,TV Show,Numberblocks,Unknown,United Kingdom,2021,Kids' TV
s67,TV Show,Raja Rasoi Aur Anya Kahaniyan,Unknown,India,2014,"Docuseries, International TV Shows"
s68,TV Show,Saved by the Bell,Unknown,United States,1994,"Kids' TV, TV Comedies"
s69,Movie,Schumacher,"Hanns-Bruno Kammertöns, Vanessa Nöcker, Michael Wech",Unknown,2021,"Documentaries, International Movies, Sports Movies"
s70,TV Show,Stories by Rabindranath Tagore,Unknown,India,2015,"International TV Shows, TV Dramas"
s71,TV Show,Too Hot To Handle: Latino,Unknown,Unknown,2021,"International TV Shows, Reality TV, Romantic TV Shows"
s72,Movie,A StoryBots Space Adventure,David A. Vargas,Unknown,2021,Children & Family Movies
s73,TV Show,Jack Whitehall: Travels with My Father,Unknown,United Kingdom,2021,"British TV Shows, Docuseries, International TV Shows"
s74,Movie,King of Boys,Kemi Adetiba,Nigeria,2018,"Dramas, International Movies"
s75,TV Show,The World's Most Amazing Vacation Rentals,Unknown,Unknown,2021,Reality TV
s76,Movie,You vs. Wild: Out Cold,Ben Simms,Unknown,2021,Children & Family Movies
s77,TV Show,Yowamushi Pedal,Unknown,Japan,2013,"Anime Series, International TV Shows"
s78,Movie,Little Singham - Black Shadow,Prakash Satam,Unknown,2021,"Children & Family Movies, Comedies"
s79,Movie,Tughlaq Durbar,Delhiprasad Deenadayalan,Unknown,2020,"Comedies, Dramas, International Movies"
s80,Movie,Tughlaq Durbar (Telugu),Delhiprasad Deenadayalan,Unknown,2021,"Comedies, Dramas, International Movies"
s81,Movie,Firedrake the Silver Dragon,Tomer Eshed,Unknown,2021,Children & Family Movies
s82,Movie,Kate,Cedric Nicolas-Troyan,United States,2021,Action & Adventure
s83,TV Show,Lucifer,Unknown,United States,2021,"Crime TV Shows, TV Comedies, TV Dramas"
s84,TV Show,Metal Shop Masters,Unknown,Unknown,2021,Reality TV
s85,Movie,Omo Ghetto: the Saga,"JJC Skillz, Funke Akindele",Nigeria,2020,"Action & Adventure, Comedies, Dramas"
s86,TV Show,Pokémon Master Journeys: The Series,Unknown,Unknown,2021,"Anime Series, Kids' TV"
s87,Movie,Prey,Thomas Sieben,Unknown,2021,"International Movies, Thrillers"
s88,TV Show,Titipo Titipo,Unknown,Unknown,2019,"Kids' TV, Korean TV Shows"
s89,Movie,Blood Brothers: Malcolm X & Muhammad Ali,Marcus Clarke,Unknown,2021,"Documentaries, Sports Movies"
s90,TV Show,Mighty Raju,Unknown,Unknown,2017,Kids' TV
s91,Movie,Paradise Hills,Alice Waddington,"Spain, United States",2019,"Sci-Fi & Fantasy, Thrillers"
s92,Movie,The Women and the Murderer,"Mona Achache, Patricia Tourancheau",France,2021,"Documentaries, International Movies"
s93,TV Show,Into the Night,Unknown,Belgium,2021,"International TV Shows, TV Dramas, TV Mysteries"
s94,Movie,JJ+E,Alexis Almström,Unknown,2021,"Dramas, International Movies, Romantic Movies"
s95,Movie,Show Dogs,Raja Gosnell,"United Kingdom, United States",2018,"Children & Family Movies, Comedies"
s96,TV Show,The Circle,Unknown,"United States, United Kingdom",2021,Reality TV
s97,Movie,If I Leave Here Tomorrow: A Film About Lynyrd Skynyrd,Stephen Kijak,United States,2018,"Documentaries, Music & Musicals"
s98,TV Show,Kid Cosmic,Unknown,United States,2021,"Kids' TV, TV Comedies, TV Sci-Fi & Fantasy"
s99,TV Show,Octonauts: Above & Beyond,Unknown,United Kingdom,2021,"British TV Shows, Kids' TV"
s100,TV Show,On the Verge,Unknown,"France, United States",2021,"TV Comedies, TV Dramas"
s101,TV Show,Tobot Galaxy Detectives,Unknown,Unknown,2019,Kids' TV
s102,Movie,Untold: Breaking Point,"Chapman Way, Maclain Way",United States,2021,"Documentaries, Sports Movies"
s103,TV Show,Countdown: Inspiration4 Mission to Space,Jason Hehir,Unknown,2021,"Docuseries, Science & Nature TV"
s104,Movie,Shadow Parties,Yemi Amodu,Unknown,2020,"Dramas, International Movies, Thrillers"
s105,TV Show,Tayo the Little Bus,Unknown,South Korea,2016,"Kids' TV, Korean TV Shows"
s106,Movie,Angamaly Diaries,Lijo Jose Pellissery,India,2017,"Action & Adventure, Comedies, Dramas"
s107,TV Show,Bunk'd,Unknown,United States,2021,"Kids' TV, TV Comedies"
s108,Movie,A Champion Heart,David de Vos,United States,2018,"Children & Family Movies, Dramas"
s109,TV Show,Dive Club,Unknown,Australia,2021,"Kids' TV, TV Dramas, Teen TV Shows"
s110,TV Show,La casa de papel,Unknown,Spain,2021,"Crime TV Shows, International TV Shows, Spanish-Language TV Shows"
s111,TV Show,Money Heist: From Tokyo to Berlin,"Luis Alfaro, Javier Gómez Santander",Unknown,2021,"Docuseries, International TV Shows, Spanish-Language TV Shows"
s112,TV Show,Sharkdog,Unknown,"United States, Singapore",2021,Kids' TV
s113,Movie,Worth,Sara Colangelo,Unknown,2021,Dramas
s114,Movie,Afterlife of the Party,Stephen Herek,Unknown,2021,"Comedies, Romantic Movies"
s115,Movie,Anjaam,Rahul Rawail,India,1994,"Dramas, International Movies, Thrillers"
s116,Movie,Bright Star,Jane Campion,"United Kingdom, Australia, France",2009,"Dramas, Romantic Movies"
s117,Movie,Dhanak,Nagesh Kukunoor,India,2015,"Comedies, Dramas, Independent Movies"
s118,Movie,Final Account,Luke Holland,"United Kingdom, United States",2021,Documentaries
s119,Movie,Gurgaon,Shanker Raman,India,2017,"Dramas, International Movies, Thrillers"
s120,Movie,Here and There,JP Habac,Unknown,2020,"Dramas, International Movies, Romantic Movies"
s121,TV Show,Heroes of Goo Jit Zu,Unknown,Australia,2021,"Kids' TV, TV Comedies"
s122,TV Show,Hotel Del Luna,Unknown,Unknown,2019,"International TV Shows, Romantic TV Shows, TV Comedies"
s123,Movie,In the Cut,Jane Campion,"United Kingdom, Australia, France, United States",2003,Thrillers
s124,TV Show,Luv Kushh,Unknown,Unknown,2012,Kids' TV
s125,TV Show,Pororo - The Little Penguin,Unknown,South Korea,2013,"Kids' TV, Korean TV Shows"
s126,TV Show,Q-Force,Unknown,United States,2021,"Crime TV Shows, TV Action & Adventure, TV Comedies"
s127,Movie,Shikara,Vidhu Vinod Chopra,India,2020,"Dramas, International Movies, Romantic Movies"
s128,Movie,A Cinderella Story,Mark Rosman,"United States, Canada",2004,"Children & Family Movies, Comedies"
s129,Movie,Agatha Christie's Crooked House,Gilles Paquet-Brenner,Unknown,2017,"Dramas, International Movies, Thrillers"
s130,Movie,An Unfinished Life,Lasse Hallström,"Germany, United States",2005,Dramas
s131,Movie,Barbie Big City Big Dreams,Scott Pleydell-Pearce,Unknown,2021,"Children & Family Movies, Music & Musicals"
s132,Movie,Blade Runner: The Final Cut,Ridley Scott,United States,1982,"Action & Adventure, Classic Movies, Cult Movies"
s133,TV Show,Brave Animated Series,Unknown,Unknown,2021,"International TV Shows, TV Action & Adventure, TV Comedies"
s134,Movie,Chappie,Neill Blomkamp,"South Africa, United States",2015,"Action & Adventure, Sci-Fi & Fantasy"
s135,Movie,Clear and Present Danger,Phillip Noyce,"United States, Mexico",1994,"Action & Adventure, Dramas"
s136,Movie,Cliffhanger,Renny Harlin,"United States, Italy, France, Japan",1993,Action & Adventure
s137,Movie,Cold Mountain,Anthony Minghella,"United States, Italy, Romania, United Kingdom",2003,"Dramas, Romantic Movies"
s138,Movie,Crocodile Dundee in Los Angeles,Simon Wincer,"Australia, United States",2001,"Action & Adventure, Comedies"
s139,Movie,Dear John,Lasse Hallström,United States,2010,"Dramas, Romantic Movies"
s140,Movie,Do the Right Thing,Spike Lee,United States,1989,"Classic Movies, Comedies, Dramas"
s141,Movie,"El patrón, radiografía de un crimen",Sebastián Schindel,"Argentina, Venezuela",2014,"Dramas, International Movies, Thrillers"
s142,Movie,Extraction,Steven C. Miller,"United States, United Kingdom, Canada",2015,Action & Adventure
s143,Movie,Freedom Writers,Richard LaGravenese,"Germany, United States",2007,Dramas
s144,Movie,Green Lantern,Martin Campbell,United States,2011,"Action & Adventure, Sci-Fi & Fantasy"
s145,Movie,House Party,Reginald Hudlin,United States,1990,"Comedies, Cult Movies"
s146,Movie,House Party 2,"George Jackson, Doug McHenry",United States,1991,"Comedies, Cult Movies, Music & Musicals"
s147,Movie,House Party 3,Eric Meza,United States,1994,"Comedies, Music & Musicals"
s148,TV Show,How to Be a Cowboy,Unknown,Unknown,2021,Reality TV
s149,TV Show,HQ Barbers,Gerhard Mostert,Unknown,2020,TV Shows
s150,Movie,I Got the Hook Up,Michael Martin,United States,1998,"Action & Adventure, Comedies"
s151,Movie,In Too Deep,Michael Rymer,United States,1999,Thrillers
s152,Movie,Initial D,"Andrew Lau Wai-keung, Alan Mak","China, Hong Kong",2005,"Action & Adventure, International Movies"
s153,Movie,Janoskians: Untold and Untrue,Brett Weiner,United States,2016,Comedies
s154,TV Show,Kid-E-Cats,Unknown,Russia,2016,Kids' TV
s155,TV Show,Kuroko's Basketball,Unknown,Japan,2015,"Anime Series, International TV Shows, Teen TV Shows"
s156,Movie,Labyrinth,Jim Henson,"United Kingdom, United States",1986,"Action & Adventure, Children & Family Movies, Cult Movies"
s157,Movie,Letters to Juliet,Gary Winick,United States,2010,"Comedies, Dramas, Romantic Movies"
s158,Movie,Level 16,Danishka Esterhazy,Canada,2018,"Sci-Fi & Fantasy, Thrillers"
s159,Movie,Love Don't Cost a Thing,Troy Byer,United States,2003,"Comedies, Romantic Movies"
s160,Movie,Love in a Puff,Pang Ho-cheung,Hong Kong,2010,"Comedies, Dramas, International Movies"
s161,TV Show,Major Dad,Unknown,United States,1992,TV Comedies
s162,Movie,Mars Attacks!,Tim Burton,United States,1996,"Comedies, Cult Movies, Sci-Fi & Fantasy"
s163,Movie,Marshall,Reginald Hudlin,"United States, China, Hong Kong",2017,Dramas
s164,Movie,My Boss's Daughter,David Zucker,United States,2003,"Comedies, Romantic Movies"
s165,Movie,Mystery Men,Kinka Usher,United States,1999,"Action & Adventure, Comedies"
s166,TV Show,Oldsters,Unknown,Unknown,2019,"Crime TV Shows, International TV Shows, Spanish-Language TV Shows"
s167,Movie,Once Upon a Time in America,Sergio Leone,"Italy, United States",1984,"Classic Movies, Dramas"
s168,Movie,Open Season 2,"Matthew O'Callaghan, Todd Wilderman","United States, Canada",2008,"Children & Family Movies, Comedies"
s169,Movie,Osmosis Jones,"Bobby Farrelly, Peter Farrelly",United States,2001,"Action & Adventure, Children & Family Movies, Comedies"
s170,Movie,Poseidon,Wolfgang Petersen,United States,2006,"Action & Adventure, Dramas"
s171,Movie,Rhyme & Reason,Peter Spirer,United States,1997,"Documentaries, Music & Musicals"
s172,Movie,Same Kind of Different as Me,Michael Carney,United States,2017,"Dramas, Faith & Spirituality"
s173,Movie,School of Rock,Richard Linklater,"United States, Germany",2003,"Comedies, Music & Musicals"
s174,Movie,Snervous Tyler Oakley,Amy Rice,United States,2015,"Documentaries, LGBTQ Movies"
s175,Movie,Tears of the Sun,Antoine Fuqua,United States,2003,"Action & Adventure, Dramas"
s176,Movie,The Blue Lagoon,Randal Kleiser,United States,1980,"Dramas, Romantic Movies"
s177,Movie,The Golden Child,Michael Ritchie,United States,1986,"Action & Adventure, Comedies"
s178,Movie,The Guns of Navarone,J. Lee Thompson,"United Kingdom, United States",1961,"Action & Adventure, Classic Movies"
s179,Movie,The Interview,"Evan Goldberg, Seth Rogen",United States,2014,"Action & Adventure, Comedies"
s180,Movie,The Nutty Professor,Tom Shadyac,United States,1996,"Comedies, Romantic Movies"
s181,Movie,The Nutty Professor II: The Klumps,Peter Segal,Unknown,2000,"Comedies, Romantic Movies"
s182,TV Show,Turning Point: 9/11 and the War on Terror,Unknown,Unknown,2021,Docuseries
s183,Movie,Welcome Home Roscoe Jenkins,Malcolm D. Lee,United States,2008,Comedies
s184,Movie,In the Line of Fire,Wolfgang Petersen,United States,1993,"Action & Adventure, Classic Movies"
s185,TV Show,Sparking Joy,Unknown,United States,2021,Reality TV
s186,Movie,Untold: Crime & Penalties,"Chapman Way, Maclain Way",Unknown,2021,"Documentaries, Sports Movies"
s187,TV Show,Hometown Cha-Cha-Cha,Unknown,Unknown,2021,"International TV Shows, Romantic TV Shows, TV Comedies"
s188,TV Show,The Ingenuity of the Househusband,Unknown,Unknown,2021,"International TV Shows, TV Comedies"
s189,Movie,2 Alone in Paris,"Ramzy Bedia, Éric Judor",France,2008,"Comedies, International Movies"
s190,TV Show,Bread Barbershop,Unknown,Unknown,2020,"Kids' TV, TV Comedies"
s191,Movie,Thimmarusu,Sharan Koppisetty,India,2021,"Dramas, International Movies"
s192,Movie,Wind River,Taylor Sheridan,"United Kingdom, Canada, United States",2017,"Dramas, Independent Movies"
s193,Movie,C Kkompany,Sachin Yardi,India,2008,"Action & Adventure, Comedies, International Movies"
s194,TV Show,D.P.,Unknown,", South Korea",2021,"International TV Shows, TV Dramas"
s195,TV Show,Deadly Sins,Unknown,Unknown,2002,"International TV Shows, Spanish-Language TV Shows, TV Dramas"
s196,Movie,EMI: Liya Hai To Chukana Padega,Saurabh Kabra,India,2008,"Comedies, Dramas, International Movies"
s197,Movie,He's All That,Mark Waters,Unknown,2021,"Comedies, Romantic Movies"
s198,TV Show,I Heart Arlo,Unknown,Unknown,2021,"Kids' TV, TV Comedies"
s199,TV Show,King of Boys: The Return of the King,Kemi Adetiba,Nigeria,2021,"Crime TV Shows, International TV Shows, TV Dramas"
s200,Movie,Koi Aap Sa,Partho Mitra,India,2006,"Comedies, Dramas, International Movies"
s201,Movie,Krishna Cottage,Santram Varma,India,2004,"Action & Adventure, Horror Movies, International Movies"
s202,Movie,Kucch To Hai,"Anil V. Kumar, Anurag Basu",India,2003,"Dramas, International Movies, Thrillers"
s203,Movie,Kyaa Kool Hai Hum,Sangeeth Sivan,India,2005,"Comedies, International Movies, Music & Musicals"
s204,Movie,Kyaa Kool Hain Hum 3,Umesh Ghadge,India,2016,"Comedies, International Movies"
s205,Movie,Kyaa Super Kool Hain Hum,Sachin Yardi,India,2012,"Comedies, International Movies"
s206,Movie,Kyo Kii... Main Jhuth Nahin Bolta,David Dhawan,India,2001,"Comedies, International Movies, Sci-Fi & Fantasy"
s207,Movie,"LSD: Love, Sex Aur Dhokha",Dibakar Banerjee,India,2010,"Dramas, Independent Movies, International Movies"
s208,Movie,Mission Istaanbul: Darr Ke Aagey Jeet Hai,Apoorva Lakhia,India,2008,"Action & Adventure, International Movies, Music & Musicals"
s209,Movie,Once Upon a Time in Mumbaai,Milan Luthria,India,2010,"Dramas, International Movies, Music & Musicals"
s210,Movie,Once Upon a Time in Mumbai Dobaara!,Milan Luthria,India,2013,"Dramas, International Movies, Music & Musicals"
s211,Movie,Ragini MMS,Pawan Kripalani,India,2011,"Horror Movies, International Movies"
s212,Movie,Ragini MMS 2,Bhushan Patel,India,2014,"Horror Movies, International Movies"
s213,TV Show,Rebellion,Unknown,Ireland,2016,"International TV Shows, TV Dramas"
s214,TV Show,RIDE ON TIME,Unknown,Unknown,2021,"Docuseries, International TV Shows"
s215,Movie,SAS: Rise of the Black Swan,Magnus Martens,Unknown,2021,"Action & Adventure, International Movies"
s216,Movie,Shootout at Lokhandwala,Apoorva Lakhia,India,2007,"Action & Adventure, Dramas, International Movies"
s217,Movie,Shor In the City,"Raj Nidimoru, Krishna D.K.",India,2011,"Comedies, Dramas, Independent Movies"
s218,Movie,The Dirty Picture,Milan Luthria,India,2011,"Comedies, Dramas, International Movies"
s219,TV Show,Titletown High,Unknown,Unknown,2021,"Reality TV, Teen TV Shows"
s220,TV Show,EDENS ZERO,Unknown,Japan,2021,"Anime Series, International TV Shows"
s221,TV Show,Family Reunion,Unknown,United States,2021,"Kids' TV, TV Comedies"
s222,Movie,"Bob Ross: Happy Accidents, Betrayal & Greed",Joshua Rofé,Unknown,2021,Documentaries
s223,TV Show,Clickbait,Brad Anderson,Unknown,2021,"Crime TV Shows, TV Dramas, TV Mysteries"
s224,TV Show,John of God: The Crimes of a Spiritual Healer,"Mauricio Dias, Tatiana Villela",Unknown,2021,"Crime TV Shows, Docuseries, International TV Shows"
s225,TV Show,Motel Makeover,Unknown,Unknown,2021,"International TV Shows, Reality TV"
s226,TV Show,Open Your Eyes,Unknown,Unknown,2021,"International TV Shows, TV Dramas, TV Mysteries"
s227,TV Show,Post Mortem: No One Dies in Skarnes,Unknown,Unknown,2021,"International TV Shows, TV Comedies, TV Dramas"
s228,Movie,Really Love,Angel Kristi Williams,United States,2020,"Dramas, Independent Movies, Romantic Movies"
s229,Movie,The November Man,Roger Donaldson,"United States, United Kingdom",2014,Action & Adventure
s230,Movie,The Old Ways,Christopher Alender,United States,2020,Horror Movies
s231,Movie,The River Runner,Rush Sturges,Unknown,2021,"Documentaries, Sports Movies"
s232,Movie,The Water Man,David Oyelowo,United States,2021,"Children & Family Movies, Dramas"
s233,TV Show,Wheel of Fortune,Unknown,United States,2019,Reality TV
s234,Movie,Count Me In,Mark Lo,United Kingdom,2021,"Documentaries, Music & Musicals"
s235,TV Show,Oggy Oggy,Unknown,Unknown,2021,"Kids' TV, TV Comedies"
s236,Movie,Untold: Caitlyn Jenner,Crystal Moselle,Unknown,2021,"Documentaries, LGBTQ Movies, Sports Movies"
s237,Movie,Boomika,Rathindran R Prasad,Unknown,2021,"Horror Movies, International Movies, Thrillers"
s238,Movie,Boomika (Hindi),Rathindran R Prasad,Unknown,2021,"Horror Movies, International Movies, Thrillers"
s239,Movie,Boomika (Malayalam),Rathindran R Prasad,Unknown,2021,"Horror Movies, International Movies, Thrillers"
s240,Movie,Boomika (Telugu),Rathindran R Prasad,Unknown,2021,"Horror Movies, International Movies, Thrillers"
s241,Movie,The Witcher: Nightmare of the Wolf,Han Kwang Il,Unknown,2021,"Action & Adventure, Anime Features"
s242,TV Show,Manifest,Unknown,United States,2021,"TV Dramas, TV Mysteries, TV Sci-Fi & Fantasy"
s243,TV Show,Comedy Premium League,Unknown,Unknown,2021,"International TV Shows, TV Comedies"
s244,TV Show,Everything Will Be Fine,Unknown,Unknown,2021,"International TV Shows, Spanish-Language TV Shows, TV Comedies"
s245,Movie,Gunshot,Karim El Shenawy,Unknown,2018,"Dramas, International Movies, Thrillers"
s246,TV Show,Korean Cold Noodle Rhapsody,Unknown,Unknown,2021,"Docuseries, International TV Shows"
s247,Movie,Man in Love,Yin Chen-hao,Unknown,2021,"Dramas, International Movies, Romantic Movies"
s248,Movie,Sweet Girl,Brian Andrew Mendoza,United States,2021,"Action & Adventure, Dramas"
s249,TV Show,The Chair,Unknown,Unknown,2021,"TV Comedies, TV Dramas"
s250,Movie,The Loud House Movie,Dave Needham,Unknown,2021,"Children & Family Movies, Comedies, Music & Musicals"
s251,Movie,A Faraway Land,Veronica Velasco,Unknown,2020,"Dramas, International Movies, Romantic Movies"
s252,Movie,Like Crazy,Drake Doremus,United States,2011,"Dramas, Independent Movies, Romantic Movies"
s253,Movie,Black Island,Miguel Alexandre,Unknown,2021,"International Movies, Thrillers"
s254,Movie,Bombay,Mani Ratnam,India,1995,"Dramas, International Movies, Romantic Movies"
s255,TV Show,Go! Go! Cory Carson,Unknown,United States,2021,Kids' TV
s256,Movie,Memories of a Murderer: The Nilsen Tapes,Michael Harte,Unknown,2021,"Documentaries, International Movies"
s257,Movie,Nneka The Pretty Serpent,Tosin Igho,Unknown,2020,"Dramas, International Movies"
s258,Movie,O Kadhal Kanmani,Mani Ratnam,Unknown,2015,"Dramas, International Movies, Romantic Movies"
s259,Movie,Out of my league,Alice Filippi,Unknown,2020,"Comedies, Dramas, International Movies"
s260,Movie,Pahuna,Paakhi Tyrewala,"India, Nepal",2018,"Comedies, Dramas, International Movies"
s261,TV Show,The Defeated,Unknown,Unknown,2020,"Crime TV Shows, International TV Shows, TV Dramas"
